project_title,short_description,long_description,PAF determination,PAF confidence ML
Adaptive and Innovative Solutions for Agri-Food Market Opportunities in Haiti/Solutions adaptées et innovatrices aux opportunités de marchés agroalimentaires en Haïti,ADAPTIVE AND INNOVATIVE SOLUTIONS FOR AGRI-FOOD MARKET OPPORTUNITIES IN HAITI/SOLUTIONS ADAPTÉES ET INNOVATRICES AUX OPPORTUNITÉS DE MARCHÉS AGROALIME,"This project aims to strengthen the maize value chain in Haiti's Sud and Artibonite departments. Its goal is to improve the livelihoods of 10,000 smallholder farm families through expanded commercialization and sustainable production of maize, along with bean, an essential companion crop. An emphasis is on creating opportunities for women and youth to contribute to - and benefit from - activities that promote added value and climate change adaptation in the targeted value chains. Project activities include: (1) increasing targeted maize producers' access to reliable, competitive, and durable markets for their product through the establishment of local purchasing centers with direct linkages to a large-scale industrial buyer , (2) improving agricultural productivity, yields, and post-harvest quality of maize and bean through promoting sustainable climate smart techniques and technologies, and (3) enhancing rural farm families' resiliency to recurrent natural disaster through disaster risk reduction awareness-raising. / Le projet vise à renforcer la filière maïs dans les départements du Sud et de l'Artibonite en Haïti. L'objectif est d'améliorer les moyens de subsistance de 10 000 petits exploitants agricoles grâce à une commercialisation élargie et une production durable de maïs, en association avec la culture du haricot. Un accent est mis sur la création d'opportunités au profit des femmes et des jeunes et d'activités contribuant à accroître la valeur ajoutée et à favoriser l'adaptation aux changements climatiques des filières ciblées. Les activités du projet comprennent: (1) améliorer l'accès des producteurs de maïs à des marchés fiables, compétitifs et durables pour leur produit grâce à la mise en place de centres d'achat locaux en relation directe avec un acheteur agro-industriel d'envergure, (2) améliorer la productivité agricole, des rendements et de la qualité post-récolte du maïs et du haricot grâce à la promotion de techniques et de technologies durables et intelligentes face au climat,(3) améliorer la résilience des ménages agricoles ruraux face aux catastrophes naturelles récurrentes par des activités de sensibilisation à la réduction des risques de catastrophe.",Review,0.0239632669836283
Open Network for WAter-Related Diseases (ONWARD),OPEN NETWORK FOR WATER-RELATED DISEASES (ONWARD),"The ONWARD Network (Open Network for Water-Related Diseases) is dedicated to forecasting, early warning & risk mapping for water-associated diseases through use of remote sensing, field observations & mathematical modelling. Our vision is to enable cost-effective, regularly updated, geo-referenced early warning for areas vulnerable to water-associated diseases, which in turn will enable preventive measures to be deployed in a timely manner to minimise the probability of epidemics. Our long-term vision is to establish a system that will be applicable broadly, in a variety of localities & for a variety of diseases. By 'water-associated' disease, we mean a rather broad class, including diarrhoeal diseases such as cholera, skin diseases associated with water-borne bacteria or metazoan parasites, vector-borne diseases such as malaria & dengue fever, & others such as hepatitis. The 'water' involved may be fresh, or brackish or coastal seawater. The network will respond primarily the GCRF Challenge of Global Health (infectious diseases), & secondarily to that of Resilience to Environmental Shocks & Change (since outbreaks of water-associated diseases are affected by extreme weather events, expected to become more frequent as a result of climate change). The network will also address UN Sustainable Development Goal 3, Target 3d, to 'Strengthen the capacity of all countries, in particular developing countries, for early warning, risk reduction & management of national & global health risks.' According to the World Health Organisation, some two billion people use faecally-contaminated drinking water, putting them at risk of death or chronic poor health from water-borne infectious diseases such as cholera, dysentery, typhoid & polio. Provision of safe drinking water is hostage to the influence of extreme weather & flooding. Apart from the fatalities, the effect of a chronic burden of lower-level infection by water-associated diseases is antagonistic to the maintenance of a healthy work force & to the well-being of society in general, to the detriment of sustainable development. For example, cholera kills an estimated 95,000 people every year, but it also makes another 2.9 million seriously ill with a debilitating disease. Hence the need to address, in addition, the resilience of communities to perturbations of the safe drinking water supply under extreme weather events associated with a changing climate. Before now, our ability to develop early warning, risk reduction & management of national & global health risks due to water-associated diseases has been limited by mutual isolation of the scientific communities whose collective effort is required to make progress. Forecasting outbreaks of water-associated diseases & their geo-referenced risk mapping is a complex matter for which the collaboration of experts from several disciplines (ranging from environmental biochemistry, genetics, molecular biology, social sciences & epidemiology to remote sensing & mode",Review,0.0168373193591833
Generating Anticipatory Measures for Better Utilization of Tropical Peatlands (GAMBUT),GENERATING ANTICIPATORY MEASURES FOR BETTER UTILIZATION OF TROPICAL PEATLANDS (GAMBUT),"The Generating Anticipatory Measures for Better Utilization of Tropical Peat lands (GAMBUT) is a $2 million USAID/Indonesia project designed to systematically reduce and mitigate peat fires. USAID is working in partnership with the United Nations Office for REDD+ Coordination in Indonesia (UNORCID). The project will work to reduce the number of burning fires, or 'hotspots', and consequently, reduced haze impacts and greenhouse gas emissions from those areas. The project will use the Sustainable Landscapes indicators on GHG reductions, as well as increased number of institutions with improved capacity to reduce emission.~",Review,0.012372225522995
Risk mapping South department UNDP,RISK MAPPING SOUTH DEPARTMENT UNDP,Improved technical competence to local decision makers in risk reduction in the South department and a developed risk mapping for use of institutions and local actors.,Review,0.0122940391302109
I.MO RRC Liban,I.MO RRC LIBAN,"Projet de réduction des Risques d'inondation dans la Bekaa sur financement Minka. Ce projet est mis en œuvre par un consortium d'ONG (Solidarités Internationales, Croix Rouge française, Croix Rouge libanaise). Prenant le relais d'une première phase d'urgence financée par le Centre de Crise du MAE, le projet vise à prévenir durablement les risques de catastrophe innondation, en s'articulant avec les administrations et collectivités locales.-I.MO RéD RISQ CATAS",Review,0.0115097220987082
I.MO RRC Liban,I.MO RRC LIBAN,"Projet de réduction des Risques d'inondation dans la Bekaa sur financement Minka. Ce projet est mis en œuvre par un consortium d'ONG (Solidarités Internationales, Croix Rouge française, Croix Rouge libanaise). Prenant le relais d'une première phase d'urgence financée par le Centre de Crise du MAE, le projet vise à prévenir durablement les risques de catastrophe innondation, en s'articulant avec les administrations et collectivités locales.-I.MO RéD RISQ CATAS",Review,0.0115097220987082
I.MO RRC Liban,I.MO RRC LIBAN,"Projet de réduction des Risques d'inondation dans la Bekaa sur financement Minka. Ce projet est mis en œuvre par un consortium d'ONG (Solidarités Internationales, Croix Rouge française, Croix Rouge libanaise). Prenant le relais d'une première phase d'urgence financée par le Centre de Crise du MAE, le projet vise à prévenir durablement les risques de catastrophe innondation, en s'articulant avec les administrations et collectivités locales.-I.MO RéD RISQ CATAS",Review,0.0115097220987082
DEVELOPMENT OF PARAMETRIC INSURANCE PRODUCTS FOR THE AGRICULTURAL SECTOR,"CARIBBEAN, REGIONAL",To assist CCRIF SPC in financing the cost of consultancy services for the development and marketing of two parametric agricultural insurance products for CDBs BMCs.,Review,0.0100791472941637
"Programme d'appui à la résilience des populations vulnérables aux risques de catastrophe (PRRC) – Burundi, Niger, RDC  - RDC","PROGRAMME D'APPUI À LA RÉSILIENCE DES POPULATIONS VULNÉRABLES AUX RISQUES DE CATASTROPHE (PRRC) – BURUNDI, NIGER, RDC  - RDC","Background: La RDC continue de faire face à une crise humanitaire complexe et prolongée. Des décennies de chocs successifs ont intensifié les besoins humanitaires et la vulnérabilité de la population. Celle-ci doit faire face aux conséquences des violences et conflits, ainsi qu'à des épidémies récurrentes, engendrant malnutrition et insécurité alimentaire. 7,5 millions de Congolais, dont 1,6 million de personnes déplacées, ont besoin d'une aide humanitaire d'urgence en 2016, principalement dans le nord et l'Est du pays. Les territoires de Lisala et Lolo, visés par le programme proposé, ont une pluviométrie importante de par leur position géographique (zone équatoriale) et subissent fréquemment les phénomènes d'érosion et d'inondations. Les effets de ces phénomènes naturels accentuent davantage la vulnérabilité des populations, en particulier celles qui se trouvent en milieu rural. Les inondations du dernier trimestre de 2015 ont touché environ 500.000 personnes dans le bassin du fleuve Congo, dont la province de la Mongala qui comprend Lisala et Lolo. - General Purpose: RDC : Augmenter la résilience des populations vulnérables par le renforcement de leurs capacités en matière de préparation et d'atténuation de l'impact des risques des catastrophes.  - Specific Purpose : Renforcer la capacité des communautés locales à limiter les impacts négatifs des inondations et des érosions sur les populations et leur milieu de vie. - Results:  R1 : Le système de veille sur les chocs-aléas climatiques mis en place dans les communautés locales est outillé et fonctionnel.R2 : Les communautés locales développent et prennent des mesures pour gérer et réduire les effets des inondations et des érosions dans leur milieu de vie.R3 : Les sources d'alimentation et de revenu des ménages accompagnés sont diversifiées et protégées contre les aléas climatiques grâce à l'adaptation du système d'exploitation agricole et de pêche.",Review,0.00973853282630444
COVID-19 Fiscal Response Program,COVID-19 FISCAL RESPONSE PROGRAM,"Vanuatu has avoided an outbreak of the coronavirus disease (COVID-19) through decisive early action to close borders and adopt prevention and containment measures. As of 12 November 2020, the country had only one confirmed case of COVID-19 contained in quarantine after being identified from a repatriation flight. Vanuatu's efforts to prevent the spread of COVID-19 have come at significant economic and social costs. The program will help finance the implementation of the government's countercyclical response, which is anchored on the Health Preparedness and Response Plan (HPRP) and the Economic Stimulus Program (ESP), to mitigate the socioeconomic consequences of COVID-19. The proposed program is aligned with four operational priorities of the Asian Development Bank (ADB) Strategy 2030—(i) addressing remaining poverty and addressing inequalities, (ii) accelerating progress in gender equality, (iii) strengthening governance and institutional capacity, and (iv) promoting rural development and food security. It is also aligned with the Pacific Approach priority of managing risks and building resilience by strengthening the health and agriculture sectors. Vanuatu meets all the CPRO access criteria.",Review,0.00863743387162685
COVID-19 Fiscal Response Program,COVID-19 FISCAL RESPONSE PROGRAM,"Vanuatu has avoided an outbreak of the coronavirus disease (COVID-19) through decisive early action to close borders and adopt prevention and containment measures. As of 12 November 2020, the country had only one confirmed case of COVID-19 contained in quarantine after being identified from a repatriation flight. Vanuatu's efforts to prevent the spread of COVID-19 have come at significant economic and social costs. The program will help finance the implementation of the government's countercyclical response, which is anchored on the Health Preparedness and Response Plan (HPRP) and the Economic Stimulus Program (ESP), to mitigate the socioeconomic consequences of COVID-19. The proposed program is aligned with four operational priorities of the Asian Development Bank (ADB) Strategy 2030—(i) addressing remaining poverty and addressing inequalities, (ii) accelerating progress in gender equality, (iii) strengthening governance and institutional capacity, and (iv) promoting rural development and food security. It is also aligned with the Pacific Approach priority of managing risks and building resilience by strengthening the health and agriculture sectors. Vanuatu meets all the CPRO access criteria.",Review,0.00863743387162685
COVID-19 Fiscal Response Program,COVID-19 FISCAL RESPONSE PROGRAM,"Vanuatu has avoided an outbreak of the coronavirus disease (COVID-19) through decisive early action to close borders and adopt prevention and containment measures. As of 12 November 2020, the country had only one confirmed case of COVID-19 contained in quarantine after being identified from a repatriation flight. Vanuatu's efforts to prevent the spread of COVID-19 have come at significant economic and social costs. The program will help finance the implementation of the government's countercyclical response, which is anchored on the Health Preparedness and Response Plan (HPRP) and the Economic Stimulus Program (ESP), to mitigate the socioeconomic consequences of COVID-19. The proposed program is aligned with four operational priorities of the Asian Development Bank (ADB) Strategy 2030—(i) addressing remaining poverty and addressing inequalities, (ii) accelerating progress in gender equality, (iii) strengthening governance and institutional capacity, and (iv) promoting rural development and food security. It is also aligned with the Pacific Approach priority of managing risks and building resilience by strengthening the health and agriculture sectors. Vanuatu meets all the CPRO access criteria.",Review,0.00863743387162685
COVID-19 Fiscal Response Program,COVID-19 FISCAL RESPONSE PROGRAM,"Vanuatu has avoided an outbreak of the coronavirus disease (COVID-19) through decisive early action to close borders and adopt prevention and containment measures. As of 12 November 2020, the country had only one confirmed case of COVID-19 contained in quarantine after being identified from a repatriation flight. Vanuatu's efforts to prevent the spread of COVID-19 have come at significant economic and social costs. The program will help finance the implementation of the government's countercyclical response, which is anchored on the Health Preparedness and Response Plan (HPRP) and the Economic Stimulus Program (ESP), to mitigate the socioeconomic consequences of COVID-19. The proposed program is aligned with four operational priorities of the Asian Development Bank (ADB) Strategy 2030—(i) addressing remaining poverty and addressing inequalities, (ii) accelerating progress in gender equality, (iii) strengthening governance and institutional capacity, and (iv) promoting rural development and food security. It is also aligned with the Pacific Approach priority of managing risks and building resilience by strengthening the health and agriculture sectors. Vanuatu meets all the CPRO access criteria.",Review,0.00863743387162685
COVID-19 Fiscal Response Program,COVID-19 FISCAL RESPONSE PROGRAM,"Vanuatu has avoided an outbreak of the coronavirus disease (COVID-19) through decisive early action to close borders and adopt prevention and containment measures. As of 12 November 2020, the country had only one confirmed case of COVID-19 contained in quarantine after being identified from a repatriation flight. Vanuatu's efforts to prevent the spread of COVID-19 have come at significant economic and social costs. The program will help finance the implementation of the government's countercyclical response, which is anchored on the Health Preparedness and Response Plan (HPRP) and the Economic Stimulus Program (ESP), to mitigate the socioeconomic consequences of COVID-19. The proposed program is aligned with four operational priorities of the Asian Development Bank (ADB) Strategy 2030—(i) addressing remaining poverty and addressing inequalities, (ii) accelerating progress in gender equality, (iii) strengthening governance and institutional capacity, and (iv) promoting rural development and food security. It is also aligned with the Pacific Approach priority of managing risks and building resilience by strengthening the health and agriculture sectors. Vanuatu meets all the CPRO access criteria.",Review,0.00863743387162685
Support to develop a Public Sector Accounting Standard Manual and Policy  and Property Market Risk Monitoring Framework,SUPPORT TO DEVELOP A PUBLIC SECTOR ACCOUNTING STANDARD MANUAL AND POLICY  AND PROPERTY MARKET RISK MONITORING FRAMEWORK,Support General Department of Policy (Ministry of Economy and Finance) to develop a Public Sector Accounting Standard Manual and Policy  and Property Market Risk Monitoring Framework,Review,0.00829911418259144
UNDP Zimbabwe Resilience Building Fund 2017 - 2021,UNDP ZIMBABWE RESILIENCE BUILDING FUND 2017 - 2021,"The ZRBF aims to increase the resilience of households and communities in Zimbabwe experiencing poverty and extreme poverty and food insecurity, primarily at the rural level, with a strong focus of gender equality and the integration of women and youths in the programme. Additionally, the programme will aim to target a minimum of 800 000 individuals and communities particularly vulnerable to the impacts of climatic change. It must be noted that the ZRBF, with gender equality at the heart of its programming will aim to target a minimum of 400 000 women in its programming.The expected results for the ZRBF, with the funding available as per 2015, is to enhance food security and livelihood diversification strategies of targeted communities that increase resilience to recurrent stresses/shocks. More specifically the ZRBF is expected to: • Increase effective evidence based institutional, legislative and policy frameworks in place at national and sub-national levels for resilience • Increase the absorptive, adaptive and transformative capacities to face shocks and the effects of climate change for approximately 800,000 people in vulnerable communities frequently exposed to multiple hazards in a total of estimated 20 of Zimbabwe's 59 rural districts. • Improved protection of household and community assets and decrease in annual economic losses due to effects of hazards and climate change • A crisis modifier that can provide early warning and early action to reduce the impact of climate induced shocks in place for the Fund. (With the new planned budget allocation, a substantial increase in the target number of beneficiaries is estimated. While it is planned that 10-25% of programmable funds will be allocated to this result area, final beneficiaries number will be subject to further needs assessment and also based on the nature of the shocks/crises and scope of the planned response.)",Review,0.00828167703002691
Scale up foresighted humanitarian aid,SCALE UP FORESIGHTED HUMANITARIAN AID,Capacity building in the area  Early Warning Early Action  and Scale up foresighted humanitarian aid to agriculture and food security,Review,0.00672508170828223
Contingency Plan for the Protection of Health in Highly Vulnerable Indigenous Peoples in Initial Contact,CONTINGENCY PLAN FOR THE PROTECTION OF HEALTH IN HIGHLY VULNERABLE INDIGENOUS PEOPLES IN INITIAL CONTACT,"",Review,0.00593389198184013
Strengthening Integrated Early Warning System in Mongolia,STRENGTHENING INTEGRATED EARLY WARNING SYSTEM IN MONGOLIA,"The proposed project will support the development of a comprehensive approach to early warning system (EWS) by putting in place the six key elements of EWS in a cycle (i) risk knowledge with appropriate assessment, (ii) monitoring and data acquisition, (iii) forecasting and warning, (iv) dissemination and communication, (v) information type and reliability, and (vi) response capacity.  To achieve the outcome, the system will involve the people and communities at risk from a range of hazards, link contingency plans supported by physical and social infrastructure, utilize cutting edge technologies including advanced multi-hazard modelling, monitoring and observation using remote sensing and ground stations aided by geographical information system, digital technology including cloud computing, social networking platform for tracking and tracing the incidences, and communication means including cell phone and unique radio frequencies, promote inclusiveness, and engage all stakeholders at different levels.The proposed project will also result in significant capacity building and awareness raising about disaster risk management and the role of disaster risk reduction strategies. The proposed loan will build on existing capacity and activities within the National Emergency and Management Agency as well as coordinate with stakeholders in the sector.",Review,0.00554639659821987
Programming and Capacity Building Support to  Agriculture Sector Priorities on Early Warning Early Action and Community-based Disaster Risk Management,DISASTER RISK REDUCTION,"",Review,0.00536694284528494
TC Gita Post Disaster Recovery,TC GITA POST DISASTER RECOVERY,1. Facilitate South-South cooperation engagement to Tonga from Fiji and Solomon Islands. 2. Support development of  Disaster Recovery Framework (DRF) to guide long-term recovery and rehabilitation work.,Review,0.00421054661273956
Strengthening the Resilience of the Mozambique Health System to Climate Change Impacts,STRENGTHENING THE RESILIENCE OF THE MOZAMBIQUE HEALTH SYSTEM TO CLIMATE CHANGE IMPACTS,"Background: A high proportion of Mozambique's total disease burden comes from climate sensitive disease (e.g malaria and diarrheal disease) or disease whose adequate management is jeopardized by frequent climate shocks (e.g HIV/AIDS). Additionally, significant national health determinants, such as water and sanitation systems and food production systems, may yet be further adversely impacted by climate variability and change. -- These vulnerabilities, combined with the poor adaptive capacity in underfunded key institutions and health programs, and lack of investments in training and advanced technology are manifest in current poor national health outcomes, which are expected to decline even more under future projected climate changes. -- The current project aims at strengthening the climate resilience of Mozambique's National Health System, in order to allow it to prepare, cope with and manage the health risks posed by climate variability and change, in a way that the essential functions of health systems are less vulnerable to climate and that facilitates sustained improvements in population health outcomes, despite an unstable climate. -- This project works on three tiers aiming to1) Improve governance, institutional and human capacity2) Strengthen existing climate sensitive disease surveillance systems, and scientific evidence on health impacts from climate change3) Build the resilience of specific health policies, strategies, programmes and plans - Specific Purpose : Among the expected outputs the project will: -- 1) Strengthen the national plan for Health Adaptation to Climate Change to ensure better governance of health adaptation.  -- 2) Establish health sector internal and external coordination mechanism to combat climate change impact to ensure maximum benefit from joint action.  -- 3) Include climate risks in core health education programs to ensure sustainable capacity building. -- 4) Mainstreams climate risk management into the National Disease Control Programs, and Health Promotion strategy and relevant health policies. -- 5) Set national research priorities to inform decisions and increase national research capacity. -- 6) Strengthen climate sensitive disease information systems.  -- 7) Develop tools for health national health authorities to manage climate risks to health (e.g. integrated risk monitoring systems to monitor climate risks to health, early warning systems, health seasonal outlooks). -- 8) Increase national communication on climate risks to health -- 9) Improve preparedness and response to climate extreme events.",Review,0.00412285421043634
