project_title,short_description,long_description,PAF determination,PAF confidence ML
Dominican Republic  DRM Development Policy Loan with a Cat DDO,DOMINICAN REPUBLIC  DRM DEVELOPMENT POLICY LOAN WITH A CAT DDO,"",Yes,0.999929547309875
Improving Agricultural Productivity and Resilience with Satellite and Cellphone Imagery to Scale Climate-Smart Crop Insurance (Cultiaf-2),IMPROVING AGRICULTURAL PRODUCTIVITY AND RESILIENCE WITH SATELLITE AND CELLPHONE IMAGERY TO SCALE CLIMATE-SMART CROP INSURANCE (CULTIAF-2),"The livelihoods of millions of smallholder farmers across the developing world are under threat from extreme weather events such as droughts, floods, and heatwaves. Risks are projected to increase significantly in future years due to climate change and the anticipation of possible losses discourages farmers from making productivity-enhancing investments, thereby trapping them in low-risk, low-return agriculture. Agricultural insurance, complemented with other risk-reducing practices, can be a sustainable approach to unlock investments in agriculture for smallholders that improve their resilience and productivity. Crop insurance protects farmers against financial risks posed by extreme weather events and has been widely advocated as a tool to help farmer households escape poverty traps and invest in climate-smart high-productivity agriculture. The number of successful insurance schemes targeting smallholders is limited due to high monitoring and verification costs of traditional insurance, low demand for index-based insurance (designed to eliminate the need to verify losses) mainly due to poor trust and basis risks (i.e. the imperfect correlation between farmers' actual losses and insurance payouts), and the fact that insurance products often neglect complementary risk-management options such as irrigation and drought-tolerant cultivars. This project aims to overcome these problems through climate-smart picture-based insurance, which uses satellite and cellphone imagery to verify losses, observe management practices, and promote the adoption of productivity-enhancing and resilient technologies through advisories and bundling. Ground pictures taken by farmers will help reduce monitoring costs, minimize basis risks, and create synergies with climate-smart resilience technologies. By taking pictures of insured crops, farmers engage directly in the insurance process and improve trust and tangibility. The project will compare the picture and satellite-based insurance with the current area and yield-based insurance and it will assess the effectiveness of increasing the productivity, resilience, and food security of women, men, and youth smallholder farmers in Kenya.  This project is funded through the second phase of the Cultivate Africa's Future Fund (CultiAF-2), a joint program of IDRC and the Australian International Food Security Research Centre of the Australian Centre for International Agricultural Research. CultiAF supports research to achieve long-term food security in eastern and southern Africa.",Yes,0.999882936477661
Improving Agricultural Productivity and Resilience with Satellite and Cellphone Imagery to Scale Climate-Smart Crop Insurance (Cultiaf-2),IMPROVING AGRICULTURAL PRODUCTIVITY AND RESILIENCE WITH SATELLITE AND CELLPHONE IMAGERY TO SCALE CLIMATE-SMART CROP INSURANCE (CULTIAF-2),"The livelihoods of millions of smallholder farmers across the developing world are under threat from extreme weather events such as droughts, floods, and heatwaves. Risks are projected to increase significantly in future years due to climate change and the anticipation of possible losses discourages farmers from making productivity-enhancing investments, thereby trapping them in low-risk, low-return agriculture. Agricultural insurance, complemented with other risk-reducing practices, can be a sustainable approach to unlock investments in agriculture for smallholders that improve their resilience and productivity. Crop insurance protects farmers against financial risks posed by extreme weather events and has been widely advocated as a tool to help farmer households escape poverty traps and invest in climate-smart high-productivity agriculture. The number of successful insurance schemes targeting smallholders is limited due to high monitoring and verification costs of traditional insurance, low demand for index-based insurance (designed to eliminate the need to verify losses) mainly due to poor trust and basis risks (i.e. the imperfect correlation between farmers' actual losses and insurance payouts), and the fact that insurance products often neglect complementary risk-management options such as irrigation and drought-tolerant cultivars. This project aims to overcome these problems through climate-smart picture-based insurance, which uses satellite and cellphone imagery to verify losses, observe management practices, and promote the adoption of productivity-enhancing and resilient technologies through advisories and bundling. Ground pictures taken by farmers will help reduce monitoring costs, minimize basis risks, and create synergies with climate-smart resilience technologies. By taking pictures of insured crops, farmers engage directly in the insurance process and improve trust and tangibility. The project will compare the picture and satellite-based insurance with the current area and yield-based insurance and it will assess the effectiveness of increasing the productivity, resilience, and food security of women, men, and youth smallholder farmers in Kenya.  This project is funded through the second phase of the Cultivate Africa's Future Fund (CultiAF-2), a joint program of IDRC and the Australian International Food Security Research Centre of the Australian Centre for International Agricultural Research. CultiAF supports research to achieve long-term food security in eastern and southern Africa.",Yes,0.999882936477661
Risk-Informed Early Action Partnership Secretariat,RISK-INFORMED EARLY ACTION PARTNERSHIP SECRETARIAT,"The over-arching ambition is to raise global awareness, action and investment into climate resilience and adaptation,",Yes,0.999873638153076
Climate Resilience and Index Insurance Project,CLIMATE RESILIENCE AND INDEX INSURANCE PROJECT,Climate Resiliency and Index Insurance for small farmers in the DR.,Yes,0.999835968017578
Market Enabling Activities,MARKET ENABLING ACTIVITIES,"To protect poor and vulnerable people, save lives and help developing countries to get back on their feet more quickly after a disaster by working with governments to strengthen planning, embed early action, and use risk financing tools like insurance and contingent credit to finance more cost-effective, rapid and reliable response to emergencies. It aims to empower governments to build resilience to natural disasters and climate change, and take ownership of their risks, with more assistance delivered through pre-financed government-led systems. Funded by the UK Government Prosperity Fund.",Yes,0.999835848808289
Market Enabling Activities,MARKET ENABLING ACTIVITIES,"To protect poor and vulnerable people, save lives and help developing countries to get back on their feet more quickly after a disaster by working with governments to strengthen planning, embed early action, and use risk financing tools like insurance and contingent credit to finance more cost-effective, rapid and reliable response to emergencies. It aims to empower governments to build resilience to natural disasters and climate change, and take ownership of their risks, with more assistance delivered through pre-financed government-led systems. Funded by the UK Government Prosperity Fund.",Yes,0.999835848808289
Market Enabling Activities,MARKET ENABLING ACTIVITIES,"To protect poor and vulnerable people, save lives and help developing countries to get back on their feet more quickly after a disaster by working with governments to strengthen planning, embed early action, and use risk financing tools like insurance and contingent credit to finance more cost-effective, rapid and reliable response to emergencies. It aims to empower governments to build resilience to natural disasters and climate change, and take ownership of their risks, with more assistance delivered through pre-financed government-led systems. Funded by the UK Government Prosperity Fund.",Yes,0.999835848808289
Costa Rica Catastrophe Deferred Draw Down Option (CAT DDO),COSTA RICA CATASTROPHE DEFERRED DRAW DOWN OPTION (CAT DDO),"",Yes,0.999827325344086
Further Development of the African Risk Capacity Insurance Company Ltd.,FURTHER DEVELOPMENT OF THE AFRICAN RISK CAPACITY INSURANCE COMPANY LTD.,Reducing the vulnerability of African countries towards increasing due to climate change extreme weather risks by improving access to and the use of customized insurance solutions .,Yes,0.99982088804245
Further Development of the African Risk Capacity Insurance Company Ltd.,FURTHER DEVELOPMENT OF THE AFRICAN RISK CAPACITY INSURANCE COMPANY LTD.,Reducing the vulnerability of African countries towards increasing due to climate change extreme weather risks by improving access to and the use of customized insurance solutions .,Yes,0.99982088804245
Disaster Risk Management Development Policy Loan with a CAT DDO,DISASTER RISK MANAGEMENT DEVELOPMENT POLICY LOAN WITH A CAT DDO,"",Yes,0.999818742275238
Support to International Federation of Red Cross and Red Crescent Socieities (IFRC) Disaster Relief Emergency Fund (Disaster Relief Emergency Fund) Program to Replenish Funds Allocated for Population Movements Resulting From Conflict,SUPPORT TO INTERNATIONAL FEDERATION OF RED CROSS AND RED CRESCENT SOCIEITIES (IFRC) DISASTER RELIEF EMERGENCY FUND (DISASTER RELIEF EMERGENCY FUND) PR,"United States Population Migration and Refugee Assistance, Appropriation 1143.  Protection and assistance needs of refugees, migrants and conflict vicitms worldwide. [International Federation of Red Cross and Red Crescent Societies]",Yes,0.999812662601471
Science for Humanitarian Emergencies and Resilience Programme.  Income (DFID),SCIENCE FOR HUMANITARIAN EMERGENCIES AND RESILIENCE PROGRAMME.  INCOME (DFID),"The programme has four focuses: disaster risk, subseasonal to seasonal forecasting, disaster risk monitoring, and the integration of these into practical decision making. The programme is targeting countries across subSaharan Africa and south Asia.",Yes,0.999803245067596
South East Europe and Caucasus Catastrophe Risk Insurance Facility (Serbia and Macedonia),SOUTH EAST EUROPE AND CAUCASUS CATASTROPHE RISK INSURANCE FACILITY (SERBIA AND MACEDONIA),"",Yes,0.999799072742462
Support of climate risk insurance,SUPPORT OF CLIMATE RISK INSURANCE,Regulatory frameworks and supervisory practices to promote inclusive insurance markets are implemented.,Yes,0.99979442358017
SUPPORT FOR HAITI TO MEET COMMITTMENT TO CARIBBEAN CATASTROPHE RISK INSURANCE FACILITY FOR THE 2020-2021 POLICY PERIOD,HAITI,"to contribute towards the cost of GOHs premium payment to CCRIF SPC for the period June 1, 2020 to May 31, 2021",Yes,0.9997918009758
Africa Risk Capacity Pool (ARC) for Drought Insurance (Inv.),AFRICA RISK CAPACITY POOL (ARC) FOR DROUGHT INSURANCE (INV.),"Financing the establishment of the Africa Risk Capacity Pool (ARC) to insurance African states against extreme droughts, thereby reducing their vulnerability due to climate change (Inv.).",Yes,0.999765455722809
Africa Risk Capacity Pool (ARC) for Drought Insurance (Inv.),AFRICA RISK CAPACITY POOL (ARC) FOR DROUGHT INSURANCE (INV.),"Financing the establishment of the Africa Risk Capacity Pool (ARC) to insurance African states against extreme droughts, thereby reducing their vulnerability due to climate change (Inv.).",Yes,0.999765455722809
CATASTROPHE DEFERRED DRAWDOWN OPTION (DPL with DDO),CATASTROPHE DEFERRED DRAWDOWN OPTION (DPL WITH DDO),"",Yes,0.999745190143585
CATASTROPHE DEFERRED DRAWDOWN OPTION (DPL with DDO),CATASTROPHE DEFERRED DRAWDOWN OPTION (DPL WITH DDO),"",Yes,0.999745190143585
Greater Mekong Subregion Sustainable Agriculture and Food Security Program (core portion),GREATER MEKONG SUBREGION SUSTAINABLE AGRICULTURE AND FOOD SECURITY PROGRAM (CORE PORTION),"The TA is aligned with the following impact: GMS as a leading supplier of safe and climate-friendly agri-food products realized. The TA will have the following outcome: investments and capacities for climate-friendly, safe and sustainable agri-food value chains increased.Output 1: Climate-friendly, inclusive and gender-conscious agri-food value chains and agribusinesses strengthened. This output will build capacities to implement climate-smart agriculture, pilot innovative technologies and mobilize financing for agribusinesses. Sub-output 1 on promoting green, inclusive and gender-conscious agri-food value chains will (i) identify policies and measures for promoting clean energy and reducing water consumption, food losses and waste in selected agri-food value chains while effectively integrating gender concerns, (ii) strengthen capacities of smallholders and agribusinesses along the value chain, including women farmers and entrepreneurs, on low carbon green supply chain management, agribusiness skills, value addition, and climate-smart agriculture technologies and practices through private-public partnerships, and (iii) conduct pilots on green supply chain management (e.g., nitrogen use efficiency and green water management) in selected agri-food value chains.Sub-output 2 on financing climate-smart agribusinesses will (i) propose measures for improving financial preparedness of small and medium agribusinesses, with specific focus on job creation for women, (ii) build capacities on green financing options for agribusinesses, and (iii) support a competitive grant scheme to small and medium agribusinesses to scale up low-carbon good manufacturing practices. Agricultural digital finance service aimed at women farmers and entrepreneurs will also be piloted. Output 2: Harmonized crop and livestock safety and quality systems adopted. Key activities on food safety and quality standards, certification and traceability include support for (i) harmonizing GMS policies and standards related to food safety and quality assurance, certification (e.g., organic, good agricultural practices, good manufacturing practices, geographic indications), accreditation, surveillance, and laboratories, (ii) establishing a platform to facilitate information exchange, coordination and food risk communication strategies, and (iii) conducting pilots on using digital technologies (e.g., artificial intelligence, Internet of Things, blockchain technologies) for food traceability and quality assurance to promote domestic and regional trade and ensure compliance with international food safety systems. Another sub-output on cross-border animal health and value chains improvement will support (i) safety policies and legislation on livestock, livestock products, and feed control, (ii) capacity strengthening for animal health workers to improve service delivery, control transboundary animal diseases and anti-microbial resistance, and (iii) piloting of advanced digital technologies for li",Yes,0.999622106552124
Greater Mekong Subregion Sustainable Agriculture and Food Security Program (core portion),GREATER MEKONG SUBREGION SUSTAINABLE AGRICULTURE AND FOOD SECURITY PROGRAM (CORE PORTION),"The TA is aligned with the following impact: GMS as a leading supplier of safe and climate-friendly agri-food products realized. The TA will have the following outcome: investments and capacities for climate-friendly, safe and sustainable agri-food value chains increased.Output 1: Climate-friendly, inclusive and gender-conscious agri-food value chains and agribusinesses strengthened. This output will build capacities to implement climate-smart agriculture, pilot innovative technologies and mobilize financing for agribusinesses. Sub-output 1 on promoting green, inclusive and gender-conscious agri-food value chains will (i) identify policies and measures for promoting clean energy and reducing water consumption, food losses and waste in selected agri-food value chains while effectively integrating gender concerns, (ii) strengthen capacities of smallholders and agribusinesses along the value chain, including women farmers and entrepreneurs, on low carbon green supply chain management, agribusiness skills, value addition, and climate-smart agriculture technologies and practices through private-public partnerships, and (iii) conduct pilots on green supply chain management (e.g., nitrogen use efficiency and green water management) in selected agri-food value chains.Sub-output 2 on financing climate-smart agribusinesses will (i) propose measures for improving financial preparedness of small and medium agribusinesses, with specific focus on job creation for women, (ii) build capacities on green financing options for agribusinesses, and (iii) support a competitive grant scheme to small and medium agribusinesses to scale up low-carbon good manufacturing practices. Agricultural digital finance service aimed at women farmers and entrepreneurs will also be piloted. Output 2: Harmonized crop and livestock safety and quality systems adopted. Key activities on food safety and quality standards, certification and traceability include support for (i) harmonizing GMS policies and standards related to food safety and quality assurance, certification (e.g., organic, good agricultural practices, good manufacturing practices, geographic indications), accreditation, surveillance, and laboratories, (ii) establishing a platform to facilitate information exchange, coordination and food risk communication strategies, and (iii) conducting pilots on using digital technologies (e.g., artificial intelligence, Internet of Things, blockchain technologies) for food traceability and quality assurance to promote domestic and regional trade and ensure compliance with international food safety systems. Another sub-output on cross-border animal health and value chains improvement will support (i) safety policies and legislation on livestock, livestock products, and feed control, (ii) capacity strengthening for animal health workers to improve service delivery, control transboundary animal diseases and anti-microbial resistance, and (iii) piloting of advanced digital technologies for li",Yes,0.999622106552124
Greater Mekong Subregion Sustainable Agriculture and Food Security Program (core portion),GREATER MEKONG SUBREGION SUSTAINABLE AGRICULTURE AND FOOD SECURITY PROGRAM (CORE PORTION),"The TA is aligned with the following impact: GMS as a leading supplier of safe and climate-friendly agri-food products realized. The TA will have the following outcome: investments and capacities for climate-friendly, safe and sustainable agri-food value chains increased.Output 1: Climate-friendly, inclusive and gender-conscious agri-food value chains and agribusinesses strengthened. This output will build capacities to implement climate-smart agriculture, pilot innovative technologies and mobilize financing for agribusinesses. Sub-output 1 on promoting green, inclusive and gender-conscious agri-food value chains will (i) identify policies and measures for promoting clean energy and reducing water consumption, food losses and waste in selected agri-food value chains while effectively integrating gender concerns, (ii) strengthen capacities of smallholders and agribusinesses along the value chain, including women farmers and entrepreneurs, on low carbon green supply chain management, agribusiness skills, value addition, and climate-smart agriculture technologies and practices through private-public partnerships, and (iii) conduct pilots on green supply chain management (e.g., nitrogen use efficiency and green water management) in selected agri-food value chains.Sub-output 2 on financing climate-smart agribusinesses will (i) propose measures for improving financial preparedness of small and medium agribusinesses, with specific focus on job creation for women, (ii) build capacities on green financing options for agribusinesses, and (iii) support a competitive grant scheme to small and medium agribusinesses to scale up low-carbon good manufacturing practices. Agricultural digital finance service aimed at women farmers and entrepreneurs will also be piloted. Output 2: Harmonized crop and livestock safety and quality systems adopted. Key activities on food safety and quality standards, certification and traceability include support for (i) harmonizing GMS policies and standards related to food safety and quality assurance, certification (e.g., organic, good agricultural practices, good manufacturing practices, geographic indications), accreditation, surveillance, and laboratories, (ii) establishing a platform to facilitate information exchange, coordination and food risk communication strategies, and (iii) conducting pilots on using digital technologies (e.g., artificial intelligence, Internet of Things, blockchain technologies) for food traceability and quality assurance to promote domestic and regional trade and ensure compliance with international food safety systems. Another sub-output on cross-border animal health and value chains improvement will support (i) safety policies and legislation on livestock, livestock products, and feed control, (ii) capacity strengthening for animal health workers to improve service delivery, control transboundary animal diseases and anti-microbial resistance, and (iii) piloting of advanced digital technologies for li",Yes,0.999622106552124
Greater Mekong Subregion Sustainable Agriculture and Food Security Program (core portion),GREATER MEKONG SUBREGION SUSTAINABLE AGRICULTURE AND FOOD SECURITY PROGRAM (CORE PORTION),"The TA is aligned with the following impact: GMS as a leading supplier of safe and climate-friendly agri-food products realized. The TA will have the following outcome: investments and capacities for climate-friendly, safe and sustainable agri-food value chains increased.Output 1: Climate-friendly, inclusive and gender-conscious agri-food value chains and agribusinesses strengthened. This output will build capacities to implement climate-smart agriculture, pilot innovative technologies and mobilize financing for agribusinesses. Sub-output 1 on promoting green, inclusive and gender-conscious agri-food value chains will (i) identify policies and measures for promoting clean energy and reducing water consumption, food losses and waste in selected agri-food value chains while effectively integrating gender concerns, (ii) strengthen capacities of smallholders and agribusinesses along the value chain, including women farmers and entrepreneurs, on low carbon green supply chain management, agribusiness skills, value addition, and climate-smart agriculture technologies and practices through private-public partnerships, and (iii) conduct pilots on green supply chain management (e.g., nitrogen use efficiency and green water management) in selected agri-food value chains.Sub-output 2 on financing climate-smart agribusinesses will (i) propose measures for improving financial preparedness of small and medium agribusinesses, with specific focus on job creation for women, (ii) build capacities on green financing options for agribusinesses, and (iii) support a competitive grant scheme to small and medium agribusinesses to scale up low-carbon good manufacturing practices. Agricultural digital finance service aimed at women farmers and entrepreneurs will also be piloted. Output 2: Harmonized crop and livestock safety and quality systems adopted. Key activities on food safety and quality standards, certification and traceability include support for (i) harmonizing GMS policies and standards related to food safety and quality assurance, certification (e.g., organic, good agricultural practices, good manufacturing practices, geographic indications), accreditation, surveillance, and laboratories, (ii) establishing a platform to facilitate information exchange, coordination and food risk communication strategies, and (iii) conducting pilots on using digital technologies (e.g., artificial intelligence, Internet of Things, blockchain technologies) for food traceability and quality assurance to promote domestic and regional trade and ensure compliance with international food safety systems. Another sub-output on cross-border animal health and value chains improvement will support (i) safety policies and legislation on livestock, livestock products, and feed control, (ii) capacity strengthening for animal health workers to improve service delivery, control transboundary animal diseases and anti-microbial resistance, and (iii) piloting of advanced digital technologies for li",Yes,0.999622106552124
