project_title,short_description,long_description,PAF determination,PAF confidence ML
"Programme d'appui à la résilience des populations vulnérables aux risques de catastrophe (PRRC) – Burundi, Niger, RDC  - BURUNDI","PROGRAMME D'APPUI À LA RÉSILIENCE DES POPULATIONS VULNÉRABLES AUX RISQUES DE CATASTROPHE (PRRC) – BURUNDI, NIGER, RDC  - BURUNDI","Background: Depuis 2015, le Burundi fait face à une crise politique et sécuritaire, caractérisée par une détérioration des conditions de vie des populations affectées. Les besoins humanitaires sont importants: environ 1,1 million de personnes ont besoin de protection et d'une assistance humanitaire immédiate, en ce compris un accès urgent aux services essentiels de base et à des moyens de subsistance. La détérioration des conditions socio-économiques, la réduction de l'accès aux services de base ainsi que les inondations localisées, ont créé de nouveaux besoins humanitaires et menacent davantage la sécurité et la dignité des personnes les plus vulnérables, en particulier les jeunes, les femmes et les enfants.La zone d'intervention proposée concerne 2 communes (Gitanga et Bukemba) de la province de Rutana, frontalière avec la Tanzanie.C'est l'une des provinces d'origine des nouveaux réfugiés burundais en Tanzanie, et elle accueille quelques milliers de déplacés internes en provenance d'autres provinces. Ces deux communes ont été touchées par des pluies diluviennes liées au phénomène El-Nino, en décembre 2015 et février 2016. Les conséquences de ces perturbations climatiques ont été accentuées par la déforestation dûe au manque de mécanismes de lutte antiérosive et de protection des sols, ainsi qu'à l'absence de préparation aux catastrophes au niveau local, ce qui a conduit à la destruction de cultures et d'infrastructures. La crise socio-politique que traverse le Burundi depuis mai 2015, ainsi que ces pluies dévastatrices, sont des facteurs aggravants de l'insécurité alimentaire chronique dans laquelle vivent les populations depuis de nombreuses années. - General Purpose: Burundi : Augmenter la résilience des populations vulnérables des Bassins-Versants de la rivière Musasa dans la Province de Rutana face aux risques de catastrophes. - Specific Purpose : Renforcer les capacités communautaires dans les communes de Bukemba et Gitanga en matière de préparation et d'atténuation aux risques de catastrophes  - Results:  I.Burundi :R1 : Les capacités communautaires à prévenir les catastrophes et à s'y préparer sont augmentéesR2 : Les capacités de résilience des populations à risque sont durablement améliorées grâce à la gestion durable de l'environnement et de leur facteur de production 'sol' ainsi qu'à la diversification de leurs sources alimentaires et de revenusR3 : Des emplois ponctuels décents, à parité en genre, permettant aux victimes des catastrophes récentes de compenser temporairement la perte de leurs moyens d'existence, sont créés dans le cadre de la réhabilitation des infrastructures prioritaires récemment détruites et concourent à améliorer / rétablir la protection des populations (accès aux services de base – santé, éducation etc.)II.Niger : R1 : les ménages et les communautés sont mieux préparés pour faire face aux chocs et à limiter les situations d'urgence qui en découlentR2: les ménages et les communautés améliorent leur gestion des re",Review,0.000865202397108078
"Strengthening EU Early Warning, Conflict Prevention and Crisis Response","STRENGTHENING EU EARLY WARNING, CONFLICT PREVENTION AND CRISIS RESPONSE","The action aims to strengthen the global risk awareness benefiting the entire international community engaged in issues related to conflict prevention and peace, in particular enhancing the capacity to prevent the emergence, re-emergence or escalation of violent conflict by strengthening the translation of conflict analysis into early action and response.",Review,0.00086064514471218
Public Expenditure and Fiscal Risk Management DPF-DDO,PUBLIC EXPENDITURE AND FISCAL RISK MANAGEMENT DPF-DDO,"",Review,0.000849897682201117
Public Expenditure and Fiscal Risk Management DPF-DDO,PUBLIC EXPENDITURE AND FISCAL RISK MANAGEMENT DPF-DDO,"",Review,0.000849897682201117
03 Asset Creation,03 ASSET CREATION,"Carry out climate adaptation, asset creation, and livelihood activities aimed at fostering resilience to shocks and stressors, and conduct early response activities in the event of a small scale disaster",Review,0.000845829141326249
"Partnerships, mobilization and innovation","PARTNERSHIPS, MOBILIZATION AND INNOVATION",All Risk Insurance coverage for artwork 01-JUL-20 to 30-JUN-21,Review,0.000839178741443902
"Forecast-based Action and Shock Responsive Social Protection in Provinces 5 and Sudhur Paschim, Nepal","FORECAST-BASED ACTION AND SHOCK RESPONSIVE SOCIAL PROTECTION IN PROVINCES 5 AND SUDHUR PASCHIM, NEPAL","Forecast-based Action and Shock Responsive Social Protection in Provinces 5 and Sudhur Paschim, Nepal",Review,0.000814917788375169
Conflict Risk Monitoring,CONFLICT RISK MONITORING,"Description of Activities and Outputs - to strengthen World Bank capacity for monitoring conflict risks at global, regional and country levels. Activity 1. Develop a methodology for identifying countries at risk of conflict and a framework for periodically monitoring and analyzing changes in conflict risks at global level over time. Activity outputs will include a comprehensive methodology note and the first iteration of a global conflict risk overview report which will be prepared annually and updated on a quarterly basis. Activity 2. Develop country and region-specific conflict risk monitoring frameworks in two countries/sub-regions in order to pilot and test how the systematic monitoring of conflict risks can support and enhance World Bank engagement on conflict prevention. Activity outputs will include country/regional monitoring frameworks for Ivory Coast and Lebanon and quarterly briefs analyzing conflict risks.Activity 3. Strengthen knowledge and learning within the World Bank on conflict prevention methodologies, approaches and applicability. Activities and outputs will include the organization of a series of internal and external learning events (BBLs, seminars, trainings) on conflict risk monitoring and the preparation of knowledge products including thematic papers and practice notes.",Review,0.000807538570370525
International Committee of the Red Cross (ICRC) - COVID 19 - Cabo Verde,INTERNATIONAL COMMITTEE OF THE RED CROSS (ICRC) - COVID 19 - CABO VERDE,"Support to combat the pandemic in the country. Financial support to the Red Cross, the entity responsible for developing and implementing the Covid Contingency Plan 19, as an auxiliary to the public authorities, within the framework of strict compliance w",Review,0.000775412074290216
Strengthening the ECOWAS Conflict Prevention Framework through National Architectures for Early Warning and Early Response (WANEP II),STRENGTHENING THE ECOWAS CONFLICT PREVENTION FRAMEWORK THROUGH NATIONAL ARCHITECTURES FOR EARLY WARNING AND EARLY RESPONSE (WANEP II),"The overall goal is the operationalization of an integrated and decentralized early warning and response system at community, national and regional levels in West Africa. The program goal of the strategic plan 2015 -2020 of the West Africa  Network for Peacebuilding (WANEP) is to strengthen the capacity for conflict prevention and early response in West Africa, and improve actions aimed at reinforcing the nexus between early warning information and appropriate early response  systems in order to reinforce the weak national networks as part of a greater peace and security apparatus.",Review,0.00076150574022904
FAO HUM 2017-2020 - FAO HUM 2020,FAO HUM 2017-2020 - FAO HUM 2020,"Humanitarian assistance to FAO, 12 month projects in Somailia x2 and Ethiopia, multiyear support to the Sahel-crisis (Mali, Niger, Cameroon and Chad), Nigeria and the DPRK, in addition to support to SFERA and the global food security cluster.",Review,0.000761267088819295
FAO HUM 2017-2020 - FAO HUM 2020,FAO HUM 2017-2020 - FAO HUM 2020,"Humanitarian assistance to FAO, 12 month projects in Somailia x2 and Ethiopia, multiyear support to the Sahel-crisis (Mali, Niger, Cameroon and Chad), Nigeria and the DPRK, in addition to support to SFERA and the global food security cluster.",Review,0.000761267088819295
FAO HUM 2017-2020 - FAO HUM 2020,FAO HUM 2017-2020 - FAO HUM 2020,"Humanitarian assistance to FAO, 12 month projects in Somailia x2 and Ethiopia, multiyear support to the Sahel-crisis (Mali, Niger, Cameroon and Chad), Nigeria and the DPRK, in addition to support to SFERA and the global food security cluster.",Review,0.000761267088819295
FAO HUM 2017-2020 - FAO HUM 2020,FAO HUM 2017-2020 - FAO HUM 2020,"Humanitarian assistance to FAO, 12 month projects in Somailia x2 and Ethiopia, multiyear support to the Sahel-crisis (Mali, Niger, Cameroon and Chad), Nigeria and the DPRK, in addition to support to SFERA and the global food security cluster.",Review,0.000761267088819295
FAO HUM 2017-2020 - FAO HUM 2020,FAO HUM 2017-2020 - FAO HUM 2020,"Humanitarian assistance to FAO, 12 month projects in Somailia x2 and Ethiopia, multiyear support to the Sahel-crisis (Mali, Niger, Cameroon and Chad), Nigeria and the DPRK, in addition to support to SFERA and the global food security cluster.",Review,0.000761267088819295
La résilience des communautés ciblées dans les provinces du Kongo Central et du Kanwgo face aux risques de catastrophe naturelles et aux problèmes san,LA RÉSILIENCE DES COMMUNAUTÉS CIBLÉES DANS LES PROVINCES DU KONGO CENTRAL ET DU KANWGO FACE AUX RISQUES DE CATASTROPHE NATURELLES ET AUX PROBLÈMES SAN,"- Results:  Dans la continuité du programme financé par la DGD entre 2014 et 2016, ce programme de résilience communautaire a pour objectif principal l'amélioration de la résilience des communautés ciblées dans les provinces du Kongo Central et du Kwango en République Démocratique du Congo (RDC), face aux risques de catastrophes naturelles et aux problèmes sanitaires. L'intervention de la Croix-Rouge de RDC (CRRDC), appuyée par la Croix-Rouge de Belgique (CRB) s'articule autour de trois volets d'activités sur base des besoins identifiés par les communautés : - La préparation et la réponse aux risques de catastrophes naturelles à travers la mise en place d'équipes communautaires capables d'accompagner les bénéficiaires dans l'identification des risques, lors de la réalisation de plans de contingence pour agir une fois que le risque se produit et dans la mise en place d'infrastructures telles que des bassins de rétention d'eau permettant de sécuriser certaines habitations lors des fortes pluies. - Le renforcement de l'accès à la santé des communautés, en particulier des femmes, à travers des activités de sensibilisations réalisées par des équipes communautaires ou par des  Clubs des mères  qui mènent des actions visant l'amélioration des connaissances des femmes sur leur santé, notamment reproductive. Les frais liés à ces activités sont couverts par des activités génératrices de revenus mises en œuvre par les ''Clubs de mères''. - L'amélioration de l'accès à l'eau potable et de l'assainissement à travers la réalisation ou réhabilitation de points d'eau potable et la promotion de l'auto-construction de latrines hygiéniques. Les Clubs des mères organiseront de l'appui-conseil individuel au sein des foyers des femmes vulnérables sur les thématiques de l'eau, l'hygiène et l'assainissement. Pour garantir la durabilité du programme, les cadres de la Croix-Rouge de RDC, les équipes décentralisées, les volontaires et les communautés bénéficiaires seront renforcées dans leurs capacités.",Review,0.000754980661440641
Early action response to global containment of Novel Coronavirus outbreak,EARLY ACTION RESPONSE TO GLOBAL CONTAINMENT OF NOVEL CORONAVIRUS OUTBREAK,"",Review,0.000733928754925728
Support to Early Response in Gambia,SUPPORT TO EARLY RESPONSE IN GAMBIA,Support to the reconciliation and security sector reform in Gambia,Review,0.000725659658201039
Effectiveness and scalability of innovative digital health solutions responding to COVID-19 crisis among refugees and vulnerable populations,EFFECTIVENESS AND SCALABILITY OF INNOVATIVE DIGITAL HEALTH SOLUTIONS RESPONDING TO COVID-19 CRISIS AMONG REFUGEES AND VULNERABLE POPULATIONS,"This project is part of an initiative that will provide evidence and strengthen capacity for bridging the knowledge gap in responding to the growing COVID-19 health crisis in the short-term and longer term. The initiative will support research on resilience building and preparedness to serve the needs of refugees and other populations on the move by promoting inter-sectoral approaches, including building bridges between humanitarian and development responses to reduce and control health risks for displaced populations, and leveraging existing local opportunities to strengthen the overall initiative. This project will investigate the effectiveness of developing and scaling up three digital health solutions in strengthening health systems and improving access to care in at-risk populations in Asia, the Middle East, and Africa. The two-year project will use the current COVID-19 pandemic to identify existing gaps in preparedness and early response of health systems. The approach will include quantitative and qualitative methods to study three critical areas related to health emergencies: early detection of illness in at-risk populations, teleconsultation to improve access to care for the hard-to-reach, and mobile applications for best practice guidelines for healthcare workers. The evidence will be communicated through a variety of academic and policy outputs.",Review,0.000672051741275936
Effectiveness and scalability of innovative digital health solutions responding to COVID-19 crisis among refugees and vulnerable populations,EFFECTIVENESS AND SCALABILITY OF INNOVATIVE DIGITAL HEALTH SOLUTIONS RESPONDING TO COVID-19 CRISIS AMONG REFUGEES AND VULNERABLE POPULATIONS,"This project is part of an initiative that will provide evidence and strengthen capacity for bridging the knowledge gap in responding to the growing COVID-19 health crisis in the short-term and longer term. The initiative will support research on resilience building and preparedness to serve the needs of refugees and other populations on the move by promoting inter-sectoral approaches, including building bridges between humanitarian and development responses to reduce and control health risks for displaced populations, and leveraging existing local opportunities to strengthen the overall initiative. This project will investigate the effectiveness of developing and scaling up three digital health solutions in strengthening health systems and improving access to care in at-risk populations in Asia, the Middle East, and Africa. The two-year project will use the current COVID-19 pandemic to identify existing gaps in preparedness and early response of health systems. The approach will include quantitative and qualitative methods to study three critical areas related to health emergencies: early detection of illness in at-risk populations, teleconsultation to improve access to care for the hard-to-reach, and mobile applications for best practice guidelines for healthcare workers. The evidence will be communicated through a variety of academic and policy outputs.",Review,0.000672051741275936
Effectiveness and scalability of innovative digital health solutions responding to COVID-19 crisis among refugees and vulnerable populations,EFFECTIVENESS AND SCALABILITY OF INNOVATIVE DIGITAL HEALTH SOLUTIONS RESPONDING TO COVID-19 CRISIS AMONG REFUGEES AND VULNERABLE POPULATIONS,"This project is part of an initiative that will provide evidence and strengthen capacity for bridging the knowledge gap in responding to the growing COVID-19 health crisis in the short-term and longer term. The initiative will support research on resilience building and preparedness to serve the needs of refugees and other populations on the move by promoting inter-sectoral approaches, including building bridges between humanitarian and development responses to reduce and control health risks for displaced populations, and leveraging existing local opportunities to strengthen the overall initiative. This project will investigate the effectiveness of developing and scaling up three digital health solutions in strengthening health systems and improving access to care in at-risk populations in Asia, the Middle East, and Africa. The two-year project will use the current COVID-19 pandemic to identify existing gaps in preparedness and early response of health systems. The approach will include quantitative and qualitative methods to study three critical areas related to health emergencies: early detection of illness in at-risk populations, teleconsultation to improve access to care for the hard-to-reach, and mobile applications for best practice guidelines for healthcare workers. The evidence will be communicated through a variety of academic and policy outputs.",Review,0.000672051741275936
Effectiveness and scalability of innovative digital health solutions responding to COVID-19 crisis among refugees and vulnerable populations,EFFECTIVENESS AND SCALABILITY OF INNOVATIVE DIGITAL HEALTH SOLUTIONS RESPONDING TO COVID-19 CRISIS AMONG REFUGEES AND VULNERABLE POPULATIONS,"This project is part of an initiative that will provide evidence and strengthen capacity for bridging the knowledge gap in responding to the growing COVID-19 health crisis in the short-term and longer term. The initiative will support research on resilience building and preparedness to serve the needs of refugees and other populations on the move by promoting inter-sectoral approaches, including building bridges between humanitarian and development responses to reduce and control health risks for displaced populations, and leveraging existing local opportunities to strengthen the overall initiative. This project will investigate the effectiveness of developing and scaling up three digital health solutions in strengthening health systems and improving access to care in at-risk populations in Asia, the Middle East, and Africa. The two-year project will use the current COVID-19 pandemic to identify existing gaps in preparedness and early response of health systems. The approach will include quantitative and qualitative methods to study three critical areas related to health emergencies: early detection of illness in at-risk populations, teleconsultation to improve access to care for the hard-to-reach, and mobile applications for best practice guidelines for healthcare workers. The evidence will be communicated through a variety of academic and policy outputs.",Review,0.000672051741275936
Effectiveness and scalability of innovative digital health solutions responding to COVID-19 crisis among refugees and vulnerable populations,EFFECTIVENESS AND SCALABILITY OF INNOVATIVE DIGITAL HEALTH SOLUTIONS RESPONDING TO COVID-19 CRISIS AMONG REFUGEES AND VULNERABLE POPULATIONS,"This project is part of an initiative that will provide evidence and strengthen capacity for bridging the knowledge gap in responding to the growing COVID-19 health crisis in the short-term and longer term. The initiative will support research on resilience building and preparedness to serve the needs of refugees and other populations on the move by promoting inter-sectoral approaches, including building bridges between humanitarian and development responses to reduce and control health risks for displaced populations, and leveraging existing local opportunities to strengthen the overall initiative. This project will investigate the effectiveness of developing and scaling up three digital health solutions in strengthening health systems and improving access to care in at-risk populations in Asia, the Middle East, and Africa. The two-year project will use the current COVID-19 pandemic to identify existing gaps in preparedness and early response of health systems. The approach will include quantitative and qualitative methods to study three critical areas related to health emergencies: early detection of illness in at-risk populations, teleconsultation to improve access to care for the hard-to-reach, and mobile applications for best practice guidelines for healthcare workers. The evidence will be communicated through a variety of academic and policy outputs.",Review,0.000672051741275936
Apoyo a la Fundación Kaha Kamasa en el fortalecimiento de su rol como actor clave para la gobernanza climática y desarrollo en el sitio arqueológico C,APOYO A LA FUNDACIÓN KAHA KAMASA EN EL FORTALECIMIENTO DE SU ROL COMO ACTOR CLAVE PARA LA GOBERNANZA CLIMÁTICA Y DESARROLLO EN EL SITIO ARQUEOLÓGICO C,"1) Protección, restauración y reforestación de áreas perimetrales de los sitios de la ciudad blanca  en la biósfera del Río Plátano.  2) Desarrollo de programas para la restauración de los ecosistemas, protección de suelos, cuencas de agua y balance de micro-climas  3) Promover la participación de los interesados locales en la acción climática",Review,0.000637723132967949
"Strengthening of the Local Government of Nariño - Colombia for preparedness for response and early action to multi-hazard scenarios (natural hazards,","STRENGTHENING OF THE LOCAL GOVERNMENT OF NARIÑO - COLOMBIA FOR PREPAREDNESS FOR RESPONSE AND EARLY ACTION TO MULTI-HAZARD SCENARIOS (NATURAL HAZARDS,","Strengthening of the Local Government of Nariño - Colombia for preparedness for response and early action to multi-hazard scenarios (natural hazards, armed conflict and migration flows from Venezuela) in 23 municipalities of the department",Review,0.000629060959909111
Risk prevention and management in Chiquitania FAO,RISK PREVENTION AND MANAGEMENT IN CHIQUITANIA FAO,"The project is planned for one year to respond to the immediate need of the area as well as to pilot a method of working to build preparedness, systems to early response as well as resilience and sustainability in the livelihoods and agricultural practices. The project proposal includes four products /working areas1. Improved livelihoods through the implementation of sustainable and resilient farming methods that considers risk management for droughts and fires.2. Municipalities and Communities implement monitoring system for droughts that is integrated in the early warning system of the department of Santa Cruz.3. Capacity development for families, communities, producer organisations and municipalities for inclusive risk management with a gender focus.4. A Multidimensional gender study and strategy to overcome the barriers women and girls face in their daily life in Chiquitania.The Project activities are expected to lead to strengthened capacities and integrated strategies in the area that will reduce the risk of natural and anthropogenic disasters (such as drought and fires). The long-term effect is expected to be increased resilience in the livelihoods and capacity to respond adequately to climatic effects that affect food security in the area.Even though the main outspoken ambition of the programme focuses on livelihoods and climate change adaptation the Embassy assess that there is a strong component and potential of climate change mitigation and the protection of biodiversity.The Embassy assess that the Project is relevant to the current Swedish development strategy with Bolivia 2016-2020, to several of the Sustainable Development Goals (1, 2, 13, 15 and 5) as well as priorities by the Bolivian government, the local government and the local civil society and communities.",Review,0.000590419163927436
Improved Early Warning and Early Response (EW-ER) to Strengthen Disaster Preparedness in Nigeria's Middle Belt,IMPROVED EARLY WARNING AND EARLY RESPONSE (EW-ER) TO STRENGTHEN DISASTER PREPAREDNESS IN NIGERIA'S MIDDLE BELT,Improved Early Warning and Early Response (EW-ER) to Strengthen Disaster Preparedness in Nigeria's Middle Belt,Review,0.000587842660024762
Contingent Credit Line for Sustainable Development,CONTINGENT CREDIT LINE FOR SUSTAINABLE DEVELOPMENT,The project's objective is to offer a line of credit that allows to provide liquidity resources when identifying periods of reduced liquidity in case both exogenous systemic disorders of external origin as in the case of exogenous economic events own country,Review,0.00057913432829082
