crs_id,project_title,short_description,long_description,purpose_name,PAF determination,PAF confidence ML
2020002980,COVID-19 Fiscal Response Program,COVID-19 FISCAL RESPONSE PROGRAM,"Vanuatu has avoided an outbreak of the coronavirus disease (COVID-19) through decisive early action to close borders and adopt prevention and containment measures. As of 12 November 2020, the country had only one confirmed case of COVID-19 contained in quarantine after being identified from a repatriation flight. Vanuatu's efforts to prevent the spread of COVID-19 have come at significant economic and social costs. The program will help finance the implementation of the government's countercyclical response, which is anchored on the Health Preparedness and Response Plan (HPRP) and the Economic Stimulus Program (ESP), to mitigate the socioeconomic consequences of COVID-19. The proposed program is aligned with four operational priorities of the Asian Development Bank (ADB) Strategy 2030—(i) addressing remaining poverty and addressing inequalities, (ii) accelerating progress in gender equality, (iii) strengthening governance and institutional capacity, and (iv) promoting rural development and food security. It is also aligned with the Pacific Approach priority of managing risks and building resilience by strengthening the health and agriculture sectors. Vanuatu meets all the CPRO access criteria.",Informal/semi-formal financial intermediaries,Review,0.0110395969823003
2020002980,COVID-19 Fiscal Response Program,COVID-19 FISCAL RESPONSE PROGRAM,"Vanuatu has avoided an outbreak of the coronavirus disease (COVID-19) through decisive early action to close borders and adopt prevention and containment measures. As of 12 November 2020, the country had only one confirmed case of COVID-19 contained in quarantine after being identified from a repatriation flight. Vanuatu's efforts to prevent the spread of COVID-19 have come at significant economic and social costs. The program will help finance the implementation of the government's countercyclical response, which is anchored on the Health Preparedness and Response Plan (HPRP) and the Economic Stimulus Program (ESP), to mitigate the socioeconomic consequences of COVID-19. The proposed program is aligned with four operational priorities of the Asian Development Bank (ADB) Strategy 2030—(i) addressing remaining poverty and addressing inequalities, (ii) accelerating progress in gender equality, (iii) strengthening governance and institutional capacity, and (iv) promoting rural development and food security. It is also aligned with the Pacific Approach priority of managing risks and building resilience by strengthening the health and agriculture sectors. Vanuatu meets all the CPRO access criteria.",STD control including HIV/AIDS,Review,0.0110395969823003
2020002980,COVID-19 Fiscal Response Program,COVID-19 FISCAL RESPONSE PROGRAM,"Vanuatu has avoided an outbreak of the coronavirus disease (COVID-19) through decisive early action to close borders and adopt prevention and containment measures. As of 12 November 2020, the country had only one confirmed case of COVID-19 contained in quarantine after being identified from a repatriation flight. Vanuatu's efforts to prevent the spread of COVID-19 have come at significant economic and social costs. The program will help finance the implementation of the government's countercyclical response, which is anchored on the Health Preparedness and Response Plan (HPRP) and the Economic Stimulus Program (ESP), to mitigate the socioeconomic consequences of COVID-19. The proposed program is aligned with four operational priorities of the Asian Development Bank (ADB) Strategy 2030—(i) addressing remaining poverty and addressing inequalities, (ii) accelerating progress in gender equality, (iii) strengthening governance and institutional capacity, and (iv) promoting rural development and food security. It is also aligned with the Pacific Approach priority of managing risks and building resilience by strengthening the health and agriculture sectors. Vanuatu meets all the CPRO access criteria.",Food crop production,Review,0.0110395969823003
2019000014003,Support to develop a Public Sector Accounting Standard Manual and Policy  and Property Market Risk Monitoring Framework,SUPPORT TO DEVELOP A PUBLIC SECTOR ACCOUNTING STANDARD MANUAL AND POLICY  AND PROPERTY MARKET RISK MONITORING FRAMEWORK,Support General Department of Policy (Ministry of Economy and Finance) to develop a Public Sector Accounting Standard Manual and Policy  and Property Market Risk Monitoring Framework,Public finance management (PFM),Review,0.00829911418259144
2020000025,DEVELOPMENT OF PARAMETRIC INSURANCE PRODUCTS FOR THE AGRICULTURAL SECTOR,"CARIBBEAN, REGIONAL",To assist CCRIF SPC in financing the cost of consultancy services for the development and marketing of two parametric agricultural insurance products for CDBs BMCs.,Agricultural policy and administrative management,Review,0.0072266235947609
2020008646,Scale up foresighted humanitarian aid,SCALE UP FORESIGHTED HUMANITARIAN AID,Capacity building in the area  Early Warning Early Action  and Scale up foresighted humanitarian aid to agriculture and food security,Emergency food assistance,Review,0.00672508170828223
2020002153,Contingency Plan for the Protection of Health in Highly Vulnerable Indigenous Peoples in Initial Contact,CONTINGENCY PLAN FOR THE PROTECTION OF HEALTH IN HIGHLY VULNERABLE INDIGENOUS PEOPLES IN INITIAL CONTACT,"",Social Protection,Review,0.00593389198184013
2020003053,Strengthening Integrated Early Warning System in Mongolia,STRENGTHENING INTEGRATED EARLY WARNING SYSTEM IN MONGOLIA,"The proposed project will support the development of a comprehensive approach to early warning system (EWS) by putting in place the six key elements of EWS in a cycle (i) risk knowledge with appropriate assessment, (ii) monitoring and data acquisition, (iii) forecasting and warning, (iv) dissemination and communication, (v) information type and reliability, and (vi) response capacity.  To achieve the outcome, the system will involve the people and communities at risk from a range of hazards, link contingency plans supported by physical and social infrastructure, utilize cutting edge technologies including advanced multi-hazard modelling, monitoring and observation using remote sensing and ground stations aided by geographical information system, digital technology including cloud computing, social networking platform for tracking and tracing the incidences, and communication means including cell phone and unique radio frequencies, promote inclusiveness, and engage all stakeholders at different levels.The proposed project will also result in significant capacity building and awareness raising about disaster risk management and the role of disaster risk reduction strategies. The proposed loan will build on existing capacity and activities within the National Emergency and Management Agency as well as coordinate with stakeholders in the sector.",Agricultural policy and administrative management,Review,0.00554639659821987
2020002428,Programming and Capacity Building Support to  Agriculture Sector Priorities on Early Warning Early Action and Community-based Disaster Risk Management,DISASTER RISK REDUCTION,"",Disaster Risk Reduction,Review,0.00536694284528494
2020001376,TC Gita Post Disaster Recovery,TC GITA POST DISASTER RECOVERY,1. Facilitate South-South cooperation engagement to Tonga from Fiji and Solomon Islands. 2. Support development of  Disaster Recovery Framework (DRF) to guide long-term recovery and rehabilitation work.,Multi-hazard response preparedness,Review,0.00421054661273956
2020CO3336,Strengthening the Resilience of the Mozambique Health System to Climate Change Impacts,STRENGTHENING THE RESILIENCE OF THE MOZAMBIQUE HEALTH SYSTEM TO CLIMATE CHANGE IMPACTS,"Background: A high proportion of Mozambique's total disease burden comes from climate sensitive disease (e.g malaria and diarrheal disease) or disease whose adequate management is jeopardized by frequent climate shocks (e.g HIV/AIDS). Additionally, significant national health determinants, such as water and sanitation systems and food production systems, may yet be further adversely impacted by climate variability and change. -- These vulnerabilities, combined with the poor adaptive capacity in underfunded key institutions and health programs, and lack of investments in training and advanced technology are manifest in current poor national health outcomes, which are expected to decline even more under future projected climate changes. -- The current project aims at strengthening the climate resilience of Mozambique's National Health System, in order to allow it to prepare, cope with and manage the health risks posed by climate variability and change, in a way that the essential functions of health systems are less vulnerable to climate and that facilitates sustained improvements in population health outcomes, despite an unstable climate. -- This project works on three tiers aiming to1) Improve governance, institutional and human capacity2) Strengthen existing climate sensitive disease surveillance systems, and scientific evidence on health impacts from climate change3) Build the resilience of specific health policies, strategies, programmes and plans - Specific Purpose : Among the expected outputs the project will: -- 1) Strengthen the national plan for Health Adaptation to Climate Change to ensure better governance of health adaptation.  -- 2) Establish health sector internal and external coordination mechanism to combat climate change impact to ensure maximum benefit from joint action.  -- 3) Include climate risks in core health education programs to ensure sustainable capacity building. -- 4) Mainstreams climate risk management into the National Disease Control Programs, and Health Promotion strategy and relevant health policies. -- 5) Set national research priorities to inform decisions and increase national research capacity. -- 6) Strengthen climate sensitive disease information systems.  -- 7) Develop tools for health national health authorities to manage climate risks to health (e.g. integrated risk monitoring systems to monitor climate risks to health, early warning systems, health seasonal outlooks). -- 8) Increase national communication on climate risks to health -- 9) Improve preparedness and response to climate extreme events.",Health policy and administrative management,Review,0.00412285421043634
20202005490001,Sudan - Humanitarian Fund - OCHA 2020/Soudan - Fonds humanitaire - OCHA 2020,SUDAN - HUMANITARIAN FUND - OCHA 2020/SOUDAN - FONDS HUMANITAIRE - OCHA 2020,"March 2020 - An estimated 9.3 million people across Sudan are in need of humanitarian assistance and protection across the country as a result of armed conflict, food insecurity, malnutrition, economic decline and disease. Approximately 1.9 million people are internally displaced within Sudan and almost 1.1 million refugees, asylum seekers and migrants from CAR, Chad, Eritrea, Ethiopia, South Sudan and Syria are present in the country. An estimated 6.2 million people are currently severely food insecure, exacerbating already high levels of malnutrition. Outbreaks of communicable diseases have strained an already overwhelmed health system.  With GAC's support, the Sudan Humanitarian Fund is providing timely allocations to national and international NGOs and United Nations agencies to meet critical humanitarian needs of people throughout the country. The Fund is managed by the Office for the Coordination of Humanitarian Affairs (OCHA). Support to the Fund is helping to achieve its objectives, including: (1) promoting early action and response to reduce loss of life, (2) enhancing response to time-critical humanitarian requirements, and (3) strengthening core elements of humanitarian response in underfunded crises. / Mars 2020 - On estime que 9,3 millions de personnes partout au Soudan ont besoin d'aide humanitaire et de protection en raison du conflit armé, de l'insécurité alimentaire, de la malnutrition, du déclin économique et de la maladie. Environ 1,9 million de personnes sont déplacées à l'intérieur du Soudan et près de 1,1 million de réfugiés, demandeurs d'asile et migrants de la République centrafricaine, du Tchad, de l'Érythrée, de l'Éthiopie, du Soudan du Sud et de la Syrie sont présents dans le pays. On estime que 6,2 millions de personnes sont actuellement en situation de grave insécurité alimentaire, ce qui aggrave des niveaux de malnutrition déjà élevés. Des épidémies de maladies transmissibles ont mis à rude épreuve un système de santé déjà surchargé.  Avec le soutien d'AMC, le Bureau de la coordination des affaires humanitaires gère le Fonds humanitaire pour le Soudan afin de fournir des allocations en temps opportun aux ONG nationales et internationales et aux agences des Nations Unies, pour répondre aux besoins humanitaires criants des populations dans tout le pays. Le soutien apporté au Fonds contribue à la réalisation de ses objectifs, notamment : 1) promouvoir une action et une intervention rapides pour réduire les pertes de vies humaines, 2) améliorer la réponse aux besoins humanitaires pressants, 3) renforcer les éléments essentiels de l'intervention humanitaire dans les crises sous-financées.",Relief co-ordination and support services,Review,0.00392134068533778
20202005490001,Sudan - Humanitarian Fund - OCHA 2020/Soudan - Fonds humanitaire - OCHA 2020,SUDAN - HUMANITARIAN FUND - OCHA 2020/SOUDAN - FONDS HUMANITAIRE - OCHA 2020,"March 2020 - An estimated 9.3 million people across Sudan are in need of humanitarian assistance and protection across the country as a result of armed conflict, food insecurity, malnutrition, economic decline and disease. Approximately 1.9 million people are internally displaced within Sudan and almost 1.1 million refugees, asylum seekers and migrants from CAR, Chad, Eritrea, Ethiopia, South Sudan and Syria are present in the country. An estimated 6.2 million people are currently severely food insecure, exacerbating already high levels of malnutrition. Outbreaks of communicable diseases have strained an already overwhelmed health system.  With GAC's support, the Sudan Humanitarian Fund is providing timely allocations to national and international NGOs and United Nations agencies to meet critical humanitarian needs of people throughout the country. The Fund is managed by the Office for the Coordination of Humanitarian Affairs (OCHA). Support to the Fund is helping to achieve its objectives, including: (1) promoting early action and response to reduce loss of life, (2) enhancing response to time-critical humanitarian requirements, and (3) strengthening core elements of humanitarian response in underfunded crises. / Mars 2020 - On estime que 9,3 millions de personnes partout au Soudan ont besoin d'aide humanitaire et de protection en raison du conflit armé, de l'insécurité alimentaire, de la malnutrition, du déclin économique et de la maladie. Environ 1,9 million de personnes sont déplacées à l'intérieur du Soudan et près de 1,1 million de réfugiés, demandeurs d'asile et migrants de la République centrafricaine, du Tchad, de l'Érythrée, de l'Éthiopie, du Soudan du Sud et de la Syrie sont présents dans le pays. On estime que 6,2 millions de personnes sont actuellement en situation de grave insécurité alimentaire, ce qui aggrave des niveaux de malnutrition déjà élevés. Des épidémies de maladies transmissibles ont mis à rude épreuve un système de santé déjà surchargé.  Avec le soutien d'AMC, le Bureau de la coordination des affaires humanitaires gère le Fonds humanitaire pour le Soudan afin de fournir des allocations en temps opportun aux ONG nationales et internationales et aux agences des Nations Unies, pour répondre aux besoins humanitaires criants des populations dans tout le pays. Le soutien apporté au Fonds contribue à la réalisation de ses objectifs, notamment : 1) promouvoir une action et une intervention rapides pour réduire les pertes de vies humaines, 2) améliorer la réponse aux besoins humanitaires pressants, 3) renforcer les éléments essentiels de l'intervention humanitaire dans les crises sous-financées.",Material relief assistance and services,Review,0.00392134068533778
20202005490001,Sudan - Humanitarian Fund - OCHA 2020/Soudan - Fonds humanitaire - OCHA 2020,SUDAN - HUMANITARIAN FUND - OCHA 2020/SOUDAN - FONDS HUMANITAIRE - OCHA 2020,"March 2020 - An estimated 9.3 million people across Sudan are in need of humanitarian assistance and protection across the country as a result of armed conflict, food insecurity, malnutrition, economic decline and disease. Approximately 1.9 million people are internally displaced within Sudan and almost 1.1 million refugees, asylum seekers and migrants from CAR, Chad, Eritrea, Ethiopia, South Sudan and Syria are present in the country. An estimated 6.2 million people are currently severely food insecure, exacerbating already high levels of malnutrition. Outbreaks of communicable diseases have strained an already overwhelmed health system.  With GAC's support, the Sudan Humanitarian Fund is providing timely allocations to national and international NGOs and United Nations agencies to meet critical humanitarian needs of people throughout the country. The Fund is managed by the Office for the Coordination of Humanitarian Affairs (OCHA). Support to the Fund is helping to achieve its objectives, including: (1) promoting early action and response to reduce loss of life, (2) enhancing response to time-critical humanitarian requirements, and (3) strengthening core elements of humanitarian response in underfunded crises. / Mars 2020 - On estime que 9,3 millions de personnes partout au Soudan ont besoin d'aide humanitaire et de protection en raison du conflit armé, de l'insécurité alimentaire, de la malnutrition, du déclin économique et de la maladie. Environ 1,9 million de personnes sont déplacées à l'intérieur du Soudan et près de 1,1 million de réfugiés, demandeurs d'asile et migrants de la République centrafricaine, du Tchad, de l'Érythrée, de l'Éthiopie, du Soudan du Sud et de la Syrie sont présents dans le pays. On estime que 6,2 millions de personnes sont actuellement en situation de grave insécurité alimentaire, ce qui aggrave des niveaux de malnutrition déjà élevés. Des épidémies de maladies transmissibles ont mis à rude épreuve un système de santé déjà surchargé.  Avec le soutien d'AMC, le Bureau de la coordination des affaires humanitaires gère le Fonds humanitaire pour le Soudan afin de fournir des allocations en temps opportun aux ONG nationales et internationales et aux agences des Nations Unies, pour répondre aux besoins humanitaires criants des populations dans tout le pays. Le soutien apporté au Fonds contribue à la réalisation de ses objectifs, notamment : 1) promouvoir une action et une intervention rapides pour réduire les pertes de vies humaines, 2) améliorer la réponse aux besoins humanitaires pressants, 3) renforcer les éléments essentiels de l'intervention humanitaire dans les crises sous-financées.",Emergency food assistance,Review,0.00392134068533778
20202005490001,Sudan - Humanitarian Fund - OCHA 2020/Soudan - Fonds humanitaire - OCHA 2020,SUDAN - HUMANITARIAN FUND - OCHA 2020/SOUDAN - FONDS HUMANITAIRE - OCHA 2020,"March 2020 - An estimated 9.3 million people across Sudan are in need of humanitarian assistance and protection across the country as a result of armed conflict, food insecurity, malnutrition, economic decline and disease. Approximately 1.9 million people are internally displaced within Sudan and almost 1.1 million refugees, asylum seekers and migrants from CAR, Chad, Eritrea, Ethiopia, South Sudan and Syria are present in the country. An estimated 6.2 million people are currently severely food insecure, exacerbating already high levels of malnutrition. Outbreaks of communicable diseases have strained an already overwhelmed health system.  With GAC's support, the Sudan Humanitarian Fund is providing timely allocations to national and international NGOs and United Nations agencies to meet critical humanitarian needs of people throughout the country. The Fund is managed by the Office for the Coordination of Humanitarian Affairs (OCHA). Support to the Fund is helping to achieve its objectives, including: (1) promoting early action and response to reduce loss of life, (2) enhancing response to time-critical humanitarian requirements, and (3) strengthening core elements of humanitarian response in underfunded crises. / Mars 2020 - On estime que 9,3 millions de personnes partout au Soudan ont besoin d'aide humanitaire et de protection en raison du conflit armé, de l'insécurité alimentaire, de la malnutrition, du déclin économique et de la maladie. Environ 1,9 million de personnes sont déplacées à l'intérieur du Soudan et près de 1,1 million de réfugiés, demandeurs d'asile et migrants de la République centrafricaine, du Tchad, de l'Érythrée, de l'Éthiopie, du Soudan du Sud et de la Syrie sont présents dans le pays. On estime que 6,2 millions de personnes sont actuellement en situation de grave insécurité alimentaire, ce qui aggrave des niveaux de malnutrition déjà élevés. Des épidémies de maladies transmissibles ont mis à rude épreuve un système de santé déjà surchargé.  Avec le soutien d'AMC, le Bureau de la coordination des affaires humanitaires gère le Fonds humanitaire pour le Soudan afin de fournir des allocations en temps opportun aux ONG nationales et internationales et aux agences des Nations Unies, pour répondre aux besoins humanitaires criants des populations dans tout le pays. Le soutien apporté au Fonds contribue à la réalisation de ses objectifs, notamment : 1) promouvoir une action et une intervention rapides pour réduire les pertes de vies humaines, 2) améliorer la réponse aux besoins humanitaires pressants, 3) renforcer les éléments essentiels de l'intervention humanitaire dans les crises sous-financées.",Material relief assistance and services,Review,0.00392134068533778
20202005490001,Sudan - Humanitarian Fund - OCHA 2020/Soudan - Fonds humanitaire - OCHA 2020,SUDAN - HUMANITARIAN FUND - OCHA 2020/SOUDAN - FONDS HUMANITAIRE - OCHA 2020,"March 2020 - An estimated 9.3 million people across Sudan are in need of humanitarian assistance and protection across the country as a result of armed conflict, food insecurity, malnutrition, economic decline and disease. Approximately 1.9 million people are internally displaced within Sudan and almost 1.1 million refugees, asylum seekers and migrants from CAR, Chad, Eritrea, Ethiopia, South Sudan and Syria are present in the country. An estimated 6.2 million people are currently severely food insecure, exacerbating already high levels of malnutrition. Outbreaks of communicable diseases have strained an already overwhelmed health system.  With GAC's support, the Sudan Humanitarian Fund is providing timely allocations to national and international NGOs and United Nations agencies to meet critical humanitarian needs of people throughout the country. The Fund is managed by the Office for the Coordination of Humanitarian Affairs (OCHA). Support to the Fund is helping to achieve its objectives, including: (1) promoting early action and response to reduce loss of life, (2) enhancing response to time-critical humanitarian requirements, and (3) strengthening core elements of humanitarian response in underfunded crises. / Mars 2020 - On estime que 9,3 millions de personnes partout au Soudan ont besoin d'aide humanitaire et de protection en raison du conflit armé, de l'insécurité alimentaire, de la malnutrition, du déclin économique et de la maladie. Environ 1,9 million de personnes sont déplacées à l'intérieur du Soudan et près de 1,1 million de réfugiés, demandeurs d'asile et migrants de la République centrafricaine, du Tchad, de l'Érythrée, de l'Éthiopie, du Soudan du Sud et de la Syrie sont présents dans le pays. On estime que 6,2 millions de personnes sont actuellement en situation de grave insécurité alimentaire, ce qui aggrave des niveaux de malnutrition déjà élevés. Des épidémies de maladies transmissibles ont mis à rude épreuve un système de santé déjà surchargé.  Avec le soutien d'AMC, le Bureau de la coordination des affaires humanitaires gère le Fonds humanitaire pour le Soudan afin de fournir des allocations en temps opportun aux ONG nationales et internationales et aux agences des Nations Unies, pour répondre aux besoins humanitaires criants des populations dans tout le pays. Le soutien apporté au Fonds contribue à la réalisation de ses objectifs, notamment : 1) promouvoir une action et une intervention rapides pour réduire les pertes de vies humaines, 2) améliorer la réponse aux besoins humanitaires pressants, 3) renforcer les éléments essentiels de l'intervention humanitaire dans les crises sous-financées.",Material relief assistance and services,Review,0.00392134068533778
