crs_id,project_title,short_description,long_description,purpose_name,PAF determination,PAF confidence ML
2020003099,Contingent Credit Line for Sustainable Development,CONTINGENT CREDIT LINE FOR SUSTAINABLE DEVELOPMENT,The project's objective is to offer a line of credit that allows to provide liquidity resources when identifying periods of reduced liquidity in case both exogenous systemic disorders of external origin as in the case of exogenous economic events own country,Informal/semi-formal financial intermediaries,Review,0.00057913432829082
2020006931,URBE Latam: Understanding Risks and Building Enhanced Capabilities in Latin American cities,URBE LATAM: UNDERSTANDING RISKS AND BUILDING ENHANCED CAPABILITIES IN LATIN AMERICAN CITIES,"URBE Latam addresses the implementation gap between sustainable development and equitable resilience. It will do so by using a transdisciplinary research approach aimed at empowering residents of disaster-prone urban poor neighbourhoods, which will underpin the co-production of enhanced, context-specific understandings of local risks and the integration of the resulting data into decision-making procedures in disaster risk reduction and sustainable development monitoring.   The project is conducted by a highly skilled multi-disciplinary research team (including social sciences, engineering and physical sciences) and adopts a dialogic co-production approach to citizen-generated data which relies upon well-established partnerships with community-based initiatives for local development, education and disaster risk reduction in Rio de Janeiro and Medellin, as well as with governmental agencies involved in disaster risk reduction and local planning and development.  URBE Latam proceeds in four integrated components that seek an enhanced understanding of risks, vulnerabilities and local capabilities in disaster-prone urban areas: first it is centred on the engagement of citizens to generate data to expand understandings of risks at the neighbourhood level, second, citizens engagement in risk will be pursued alongside an analysis of socio-spatial inequalities in resilience and development indicators and policies at city and national level, third, this will lead to the recalibration of environmental risk mapping with citizen-generated data, fourth, these components are articulated and integrated within a framework to facilitate dialogic transformations across the different levels and stakeholders involved.  The process of advancing these outputs will further enable capacity development in local communities and the governments of Rio de Janeiro and Medellin, a process which will be augmented by improving the awareness of stakeholders in other Latin American cities and countries through broader dissemination.  Insights from collaboratively produced citizen-generated data will be integrated into the practices of disaster risk management and development monitoring (e.g. SDG reporting) in collaboration with international policymaking agencies, thus enabling transformations towards more equitable disaster risk reduction and sustainable development. As an overarching outcome, the project will enable the transformation of practices, improve knowledge among a diverse range of stakeholders and enhance capacity to promote equitable resilience.",Research/scientific institutions,Review,0.000577683618757874
2013130621,F.a: Integrated CBDR Resilience Project,F.A: INTEGRATED CBDR RESILIENCE PROJECT,"School based disaster preparedness projects where local Red Cross youth clubs are set up, equiped and trained. School contingency plans are updated and drills are organized. Pupils and teachers skills are increased through training (including first aid) and culture of safety is disseminated through peers.",Multi-hazard response preparedness,Review,0.000531113124452531
2020000050,Geothermal Financing and Risk Transfer Facility,GEOTHERMAL FINANCING AND RISK TRANSFER FACILITY,"To increase power production from geothermalsources so as to contribute to the diversification of the energy matrix and reduce dependency on fossil fuels and GHG emissions in Mexico. To this end, the program intends to scale up investment in geothermal power generation projectsby making available a range of financial mechanisms tailored to meet the specific needs of each project's stage of development.",Geothermal energy,Review,0.000510612095240504
2020001586,DRF by TRAC2,DRF BY TRAC2,UNDP serves as integrator and contributor for Drought Recovery / Resilience Framework (DRF) 2018-22,Immediate post-emergency reconstruction and rehabilitation,Review,0.000450316234491766
2019CO3679,CARITAS – ERICA: Renforcement des capacités de gestion des risques et catastrophes des populations vulnérables - PG/2019/03,CARITAS – ERICA: RENFORCEMENT DES CAPACITÉS DE GESTION DES RISQUES ET CATASTROPHES DES POPULATIONS VULNÉRABLES - PG/2019/03,"Background: Depuis 2015, le Burundi fait face à une crise politique et sécuritaire, caractérisée par une détérioration des conditions de vie des populations affectées, notamment au niveau de la protection de leurs droits, de leur accès aux services essentiels de base ainsi qu'à leurs moyens de subsistance. Les besoins humanitaires sont importants : environ 1/3 de la population burundaise nécessite une protection et une assistance humanitaire immédiate. Environ 390.000 Burundais, dont plus de la moitié sont des enfants, ont fui leur domicile vers des pays voisins, et le nombre d'IDP s'élève à 170.000 personnes. La détérioration continue de la situation socio-économique, ainsi que les incidents et catastrophes naturelles qui se répètent et s'intensifient, provoquent une vulnérabilité des populations tant rurales qu'urbaines. - General Purpose: Augmenter la résilience des populations vulnérables par le renforcement de leurs capacités de gestion des risques et catastrophes. - Specific Purpose : Renforcer les capacités communautaires et des ménages de Gisuru en matière de prévention et de réduction des risques de catastrophe, plus particulièrement face à l'érosion des collines et parcelles, et face aux inondations. - Results:  Résultat 1 : Un mécanisme intercommunautaire de prévention et de réduction des risques de catastrophes est mis en place.Résultat 2 : Les capacités opérationnelles de prévention et de réponse à l'érosion de la chaîne Mpungwe sont renforcées au niveau communautaire.Résultat 3 : Les capacités opérationnelles de prévention et de réponse à l'érosion des parcelles sont renforcées au niveau des ménages.Résultat 4 : La vulnérabilité des ménages est durablement diminuée grâce à la création d'emplois décents (réhabilitation des infrastructures prioritaires détruites par les inondations) et à la diversification de leurs sources de revenus.",Multi-hazard response preparedness,Review,0.000440482777776197
2018500083,IGAD Promoting Peace and Stability in the Horn of Africa Region (IPPSHAR) - ADC co-financing,IGAD PROMOTING PEACE AND STABILITY IN THE HORN OF AFRICA REGION (IPPSHAR) - ADC CO-FINANCING,"This contribution covers the ADC co-financing of EUR 1 Mio. to ADC Project Reference Number 6545-00/2017 (EC funds for grants, technical assistance and project management) and ADC Project Reference Number 6545-01/2017 (EC funds for the Project  Implementation Partnership Agreement with IGAD). Further co-financing by Sida (Swedish International Development Cooperation Agency) is planned.The overall objective of the Action is to contribute to achieving sustainable peace, security and stability for the attainment of economic integration and development of the IGAD region. The Action aims to support IGAD in the implementation of  its Peace and Security Strategy 2016-2020. The Action has four specific objectives:1. To enhance the IGAD Conflict Early Warning and Response Mechanism (CEWARN) Systems, so that there is an improvement in the quantity and quality of the information collected, in data analysis, and early response action2. To enable IGAD and national governments in the region to predict, prevent, and address transnational security threats3. To enhance the capacity of IGAD and national governments of the region on preventive diplomacy, mediation and civilian peace Building4. To enhance the implementation effectiveness of IGAD's Peace and Security Division and Units.","Civilian peace-building, conflict prevention and resolution",Review,0.00041303550824523
2016000607002,Pro-Resilient Fiji – Strengthening climate resilience of communities for food and nutrition security,PRO-RESILIENT FIJI – STRENGTHENING CLIMATE RESILIENCE OF COMMUNITIES FOR FOOD AND NUTRITION SECURITY,"The objective of the project is to structurally and sustainably reduce food and nutrition insecurity derived from the negative impact of climate change induced disasters by tackling the root and underlying causes of vulnerability. It will do so by strengthening the capacity of El Nino-affected communities  and village, provincial and national governments to identify climate risks and vulnerabilities, strengthen Early Warning Early Action (EWEA) systems.",Agricultural education/training,Review,0.000387617445085198
2020013319,Implementation and Financing of Ecosystem-based Adaptation (EbA) by the Food and Agriculture Sector to reduce climate risk and environmental impacts,IMPLEMENTATION AND FINANCING OF ECOSYSTEM-BASED ADAPTATION (EBA) BY THE FOOD AND AGRICULTURE SECTOR TO REDUCE CLIMATE RISK AND ENVIRONMENTAL IMPACTS,"In Latin America, climate change is disrupting agricultural systems, e.g. causing water scarcity, severe flooding and soil erosion. Via demonstration and improved enabling environment for EbA, the programme transforms 3 million hectars of agricultural systems in the partner countries into regenerative landscapes that benefit climate, biodiversity, productivity and producers. It builds knowledge of EbA agriculture options, including analyses of barriers and how to overcome them, and improves regulatory frameworks to promote EbA measures and eliminate disincentives. The project develops and tests business models with climate and agriculture data and implement at least three risk-transfer solutions to enable finance & investment. At least 15 private companies and related producers will adopt these approaches to achieve climate-resilient value chains. A multi-stakeholder platform will enable public-private-community coordination and promoting wide-scale adoption of EbA in agriculture.",Agricultural land resources,Review,0.000377369462512434
2020000374,COVID-19 KIG response detention centres,COVID-19 KIG RESPONSE DETENTION CENTRES,"Reinforce the capacity of authorities to take measures to prevent the transmission of COVID-19 to detainees, and to develop contingency plans and implement them in the event of an outbreak.",COVID-19 control,Review,0.000376254785805941
2020900338022,Strengthening early action capacity of local first responders and communities,STRENGTHENING EARLY ACTION CAPACITY OF LOCAL FIRST RESPONDERS AND COMMUNITIES,Strengthening early action capacity of local first responders and communities,Multi-hazard response preparedness,Review,0.000361702434020117
2009013249,Public Expenditure Support Facility (DPL-DDO),PUBLIC EXPENDITURE SUPPORT FACILITY (DPL-DDO),"",Public finance management (PFM),Review,0.000356948323315009
2020100099,"Mettre en œuvre un ensemble de mesures de prévention de la malnutrition comprenant la distribution d'aliments nutritifs spécialisés aux enfants âgés de 6 à 23 mois et aux filles et aux femmes enceintes et allaitantes, des transferts monétaires en faveur des filles et des femmes enceintes et allaitan",METTRE EN ŒUVRE UN ENSEMBLE DE MESURES DE PRÉVENTION DE LA MALNUTRITION COMPRENANT LA DISTRIBUTION D'ALIMENTS NUTRITIFS SPÉCIALISÉS AUX ENFANTS ÂGÉS D,"Aider les groupes ciblés, grâce à la création d'actifs et de moyens d'existence, au développement de chaînes de valeur tenant compte de la problématique hommes-femmes et de la nutrition, à des dispositifs d'assurance climatique et à des techniques et pratiques de production innovantes [catégorie d'activité 2, modalités: transferts de type monétaire et renforcement des capacités]",Immediate post-emergency reconstruction and rehabilitation,Review,0.000348288827808574
2018000201228,Apoyo a la Fundación Kaha Kamasa en el fortalecimiento de su rol como actor clave para la gobernanza climática y desarrollo en el sitio arqueológico C,APOYO A LA FUNDACIÓN KAHA KAMASA EN EL FORTALECIMIENTO DE SU ROL COMO ACTOR CLAVE PARA LA GOBERNANZA CLIMÁTICA Y DESARROLLO EN EL SITIO ARQUEOLÓGICO C,"1) Protección, restauración y reforestación de áreas perimetrales de los sitios de la ciudad blanca  en la biósfera del Río Plátano.  2) Desarrollo de programas para la restauración de los ecosistemas, protección de suelos, cuencas de agua y balance de micro-climas  3) Promover la participación de los interesados locales en la acción climática",Democratic participation and civil society,Review,0.000345094420481473
2020014142F,Geo-processes of the continental and oceanic lithosphere,GEO-PROCESSES OF THE CONTINENTAL AND OCEANIC LITHOSPHERE,"It is intended to analyse and prepare the preconditions for a mobile and flexibly useable seismic SH source which generates shear waves for the near-surface analysis of the ground medium. The distinctive feature of the technologies and physical active principle is the requirement to generate single SH waves with a moderate effort within a dedicated research area or along a predefined profile. The reliable reproducibility of the energy of single shots is highly important for the field application and research. It must be ensured that single impulses have a low variation with respect to energy, amplitude and frequency during a campaign. The technology shall be useable in the field fulfilling the given requirements and creates the basis for a future field application by increasing efficiency, mobility and performance at real outdoor conditions. - Research funding with particular importance for the developing country on earthquake / tsunami prevention",Multi-hazard response preparedness,Review,0.000332875817548484
2020060649A,Blended Finance OECD 2020-22 - Blended Finance OECD 2021,BLENDED FINANCE OECD 2020-22 - BLENDED FINANCE OECD 2021,"Sweden, via Sida, is closely engaged in many parts of the OECD work, and is planning a voluntary contribution for 2021 for the work referred to in the workplan as Promoting greater awareness of more technical topics, such as additionality, risk transfer and securitisation technics.  The Sweden/Sida and OECD cooperation will focus on 1.Regulatory blockages: an area that have continuously been highlighted as preventing the flow of funds to developing countries. Sida and OECD are inspired by the recent report by the Global Investors for Sustainable Development called Renewed Recharged and Reinforced, urgent actions to harmonise and scale sustainable finance from July 2020 and OECD is planning to organize an event on the report and document possible policy measures for different actors and possible follow-up activities at the OECD February conference,   2.Secondly, Sweden/Sida will support OECD for a longer research activity around securitisation technics and implications relating to financial modelling. We are particularly interested in aspects of transparency and legislative prerequisites. While the focus will be on cooperation with development finance institutions we also hope to explore the possibilities and challenges to connect with private financial institutions,The latter is important as one of the main challenges in ensuring effective capital flows for the SDGs is the availability of projects and assets that are both bankable and aggregated in sufficiently large portfolios. Secutarisation technics is one potential way forward.",Financial policy and administrative management,Review,0.0003234951000195
2015485800,Petits territoires insulaires,PETITS TERRITOIRES INSULAIRES,Renforcer la résilience côtière pour la réduction des risques de catastrophe et l'adaptation au changement climatique dans les petits territoires insulaires en intégrant des infrastructures vertes et grises-ADAPTATION CHANGEMENT CLIMATIQUE,Environmental research,Review,0.000296611891826615
2018001214020,"Contributing to improved Disaster Risk Reduction, preparedness for response and early action in Lesotho","CONTRIBUTING TO IMPROVED DISASTER RISK REDUCTION, PREPAREDNESS FOR RESPONSE AND EARLY ACTION IN LESOTHO","Contributing to improved Disaster Risk Reduction, preparedness for response and early action in Lesotho",Multi-hazard response preparedness,Review,0.000290834432234988
2020014142C,Geo-processes of the continental and oceanic lithosphere,GEO-PROCESSES OF THE CONTINENTAL AND OCEANIC LITHOSPHERE,"This project will provide new insights on earthquakes and mass movements in Central Asia. The densely populated Afghan-Tajik basin and its margins differ on seismic activity - low activity in the basin contrasts concentrated activity along the margins. The so-called Tajik-Afghan belt of danger marks the study area of this project proposal. We will localise fault zones along which earthquakes are likely to occur. We will describe their deformation history and kinematics, and reconstruct their past tension fields in order to evaluate the shear stresses along the fault zones and whether the tension fields have changed during the last 10 Ma. We will create a mass wasting inventory to relate the magnitude and frequency of such events with potentially active faults, the geology, and relief. - Research funding with particular importance for the developing country on earthquake / tsunami prevention",Multi-hazard response preparedness,Review,0.000264974776655436
2020001057,Support to WHO's early response to Covid-19,SUPPORT TO WHO'S EARLY RESPONSE TO COVID-19,"Support to WHO's early response to Covid-19,  in China and the region, ref. WHOs strategic Preparedness and Response Plan for Covid-19.",COVID-19 control,Review,0.000258502812357619
2020900496011,Capacity Strengthening for Rapid Response and Early Action for Viral Haemorrhagic Diseases in South Sudan,CAPACITY STRENGTHENING FOR RAPID RESPONSE AND EARLY ACTION FOR VIRAL HAEMORRHAGIC DISEASES IN SOUTH SUDAN,Capacity Strengthening for Rapid Response and Early Action for Viral Haemorrhagic Diseases in South Sudan,Material relief assistance and services,Review,0.000254264246905223
2020000809,Incr. Human Security to DRR,INCR. HUMAN SECURITY TO DRR,Le projet vise principalement a accroitre la securite humaine face aux risques de catastrophe naturelles en Haiti.,Multi-hazard response preparedness,Review,0.000253774545853958
2020000443,Public Health support to the COVID Contingency Plan of the SICA Region,PUBLIC HEALTH SUPPORT TO THE COVID CONTINGENCY PLAN OF THE SICA REGION,Support the procurement and distribution of medical equipment and materials that are urgently needed to boost COVID emergency preparedness and response in SICA countries.,COVID-19 control,Review,0.00024571712128818
2020500272,IRePeaL - Integrated Response to People affected by Locusts,IREPEAL - INTEGRATED RESPONSE TO PEOPLE AFFECTED BY LOCUSTS,"To contribute to the mitigation of the devastating effects of locust upsurge on food security and livelihoods and to sustain and safeguard the lives of most affected and vulnerable Households (HH) in SNNP Region, Ethiopia (SDG 1, 2, 5, 10). Specific Objectives: SO1: Vulnerable HH, especially female headed HH & HHs with children and pregnant and lactating women (PLW), in SNNP Region affected by the locust upsurge are able to sustain their lives and have increased food security and  access to nutritious food (relief), SO2: Vulnerable HH, with emphasis on female headed HH, affected by the locust crisis have restored and diversified their livelihoods (recovery), SO3: Affected vulnerable communities have enhanced their  preparedness and mitigation practices and increased their resilience to future locust invasion and similar crises through the establishment of a sustainable, durable and coordinated early action/warning mechanism.",Material relief assistance and services,Review,0.000244494469370693
2015150139,Support to Nepal's School Sector Development Plan (SSDP) Covid-19 response,SUPPORT TO NEPAL'S SCHOOL SECTOR DEVELOPMENT PLAN (SSDP) COVID-19 RESPONSE,In spring 2020 the Nepal Ministry of Education and the Nepal Education Cluster have jointly developed a separate COVID-19 adaptation plan (COVID-19 Education Cluster Contingency Plan - Nepal Education Cluster 2020) for the education sector programme SSDP (The School Sector Development Plan). The Ministry of Education made a general request for all donors including Finland of additional funding for covid-19 emergency response.The overall objective of the Education Cluster Contingency Plan is to prevent the spread of COVID-19 from education institutions into local communities by providing safe learning environments by putting in place appropriate prevention measures in Nepalese schools. To achieve this objective the immediate response of the Education Cluster will focus on a) Ensuring adequate capacity for management and coordination during the response period b) Strengthening prevention and resilience within the school system and among students teachers parents and caregivers and c) Support Continuity of Education/Learning for all children in all areas including children with disabilities and from marginalized backgrounds.Finland's financial contrbution for the implementation of the Education Cluster Contingency Plan for COVID-19 is EUR 2 514 999. The support will be channeled and monitored as part of Nepal School Sector Development Plan (SSDP) programme. The School Sector Development Plan (SSDP) program covers the entire basic education system in Nepal and is funded jointly by the Government of Nepal and its Development Partners. The program is implemented during the years 2016-2023. Finland supports the program with a total of 20 million euros in the years 2016-2020.,Education policy and administrative management,Review,0.000242941765463911
2020000082,"Leadership, advocacy and communication","LEADERSHIP, ADVOCACY AND COMMUNICATION","To carry out editing and proofreading work on the following document Rights in a pandemic: a report on lockdowns, rights, and lessons from the HIV in the early response to COVID-19.",Social mitigation of HIV/AIDS,Review,0.000228625009185635
2018001782,Women's shear butter in the Savanes,WOMEN'S SHEAR BUTTER IN THE SAVANES,"Promoting women empowerment by supporting a small start up run by women in the feald of shear collection and trasformation, implementating a reforestation project aimed at protecting the local environmental system. Nanyibe villages (Naki-East Canton), Gniempol and Kpinkankandi villages (Borgou Canton) - Savanes Region",Rural development,Review,0.000226512114750221
2009013240,Public Finance and Competitiveness Development Policy Loan with Deferred Drawdown Option,PUBLIC FINANCE AND COMPETITIVENESS DEVELOPMENT POLICY LOAN WITH DEFERRED DRAWDOWN OPTION,"",Technological research and development,Review,0.000208290017326362
2009013236,Public Finance and Competitiveness Development Policy Loan with Deferred Drawdown Option,PUBLIC FINANCE AND COMPETITIVENESS DEVELOPMENT POLICY LOAN WITH DEFERRED DRAWDOWN OPTION,"",Upper Secondary Education (modified and includes data from 11322),Review,0.000208290017326362
2009013239,Public Finance and Competitiveness Development Policy Loan with Deferred Drawdown Option,PUBLIC FINANCE AND COMPETITIVENESS DEVELOPMENT POLICY LOAN WITH DEFERRED DRAWDOWN OPTION,"",Telecommunications,Review,0.000208290017326362
2009013238,Public Finance and Competitiveness Development Policy Loan with Deferred Drawdown Option,PUBLIC FINANCE AND COMPETITIVENESS DEVELOPMENT POLICY LOAN WITH DEFERRED DRAWDOWN OPTION,"",Public finance management (PFM),Review,0.000208290017326362
2009013237,Public Finance and Competitiveness Development Policy Loan with Deferred Drawdown Option,PUBLIC FINANCE AND COMPETITIVENESS DEVELOPMENT POLICY LOAN WITH DEFERRED DRAWDOWN OPTION,"",Health policy and administrative management,Review,0.000208290017326362
2020010133,"Multisectoral emergency response to the acute needs of the most vulnerable IDPs and returnees in Guji and West Guji zones, Oromia, and in SNNPR","MULTISECTORAL EMERGENCY RESPONSE TO THE ACUTE NEEDS OF THE MOST VULNERABLE IDPS AND RETURNEES IN GUJI AND WEST GUJI ZONES, OROMIA, AND IN SNNPR","This life-saving action contributes to the reduction of morbidity and mortality in Guji and West Guji zones, Oromia, and in SNNPR (incl. Gedeo, South Omo and Sidama). All preselected woredas are in acute need of humanitarian assistance. The multisectoral action will improve access to safe drinking water, WASH & shelter NFIs and basic needs. Cash modality and the Crisis Modifier are vital components of the action.",Immediate post-emergency reconstruction and rehabilitation,Review,0.000201658578589559
2020002861,"Coordination, convening and country implementation support","COORDINATION, CONVENING AND COUNTRY IMPLEMENTATION SUPPORT",Additional cost shared billing for the COVID-19 contingency plan and Nairobi Isolation centre.,Social mitigation of HIV/AIDS,Review,0.000195221669855528
